titles,summaries,terms
GYMLIB,Gymlib is a French startup that offers fitness spaces.,['sport tech']
BURNALONG,BurnAlong is a personalized wellbeing class and social motivation to help people get the health and wellness they need.,['sport tech']
Omsignal,"OMsignal is “apparel that continuously tracks your biometrics to help you connect to a fitter, healthier, happier you.”",['sport tech']
Playsight,"PlaySight is a pioneer in the emerging market of affordable, consumer sports analytics systems and co-founder Chen Shachar and team created their new tennis arm SmartCourt now its raised around $5million in funding rounds.",['sport tech']
"Zepp Labs, Inc.",This startup uses 3-D motion technology to produce data and communicate it real-time in a meaningful way with Bluetooth activation and also raised $15 million in new VC funding to get up and running.,['sport tech']
 Strava,"Strava targets intense exercisers—those who work out several times a week—and is mainly focused on cyclists and extreme athletes, which makes sense as the inspiration behind Strava was an online cycling club.",['sport tech']
RunKeeper ,RunKeeper is a fitness technology company that packs the benefits of a personal trainer into the convenience of a smartphone,['sport tech']
New Examples of Sports Technology That's Changing The ...,"Oct 22, 2019 ‚Äî New Examples of Sports Technology That's Changing The Game ¬∑ Sensors ¬∑ Wearable Tech ¬∑ VAR ¬∑ Reflexion ¬∑ Protective Equipment ¬∑ Timing Systems ¬∑ ABS.",['sport tech']
SportTechie | Sports Technology News,"At SportTechie, we make sports smarter. Through immersive storytelling and industry-leading events, we connect you to the innovators and power brokers who¬†...",['sport tech']
The future of sports tech: Here's where investors are placing ...,"Oct 1, 2019 ‚Äî Technology has been quietly transforming the world of sports for years, with investment in areas like esports continuing to rise, surpassing a¬†...",['sport tech']
The Evolution of Technology in Sport - Hire Intelligence,"Learn about the evolution of technology in sport with Hire Intelligence, including how technology in athletics, football and tennis has changed.",['sport tech']
Technology in Sports,"Sport Specific ¬∑ Tennis - it is now standard at the major tennis tournaments for a line review system to be in place, with players given power to review¬†...",['sport tech']
How Technology is Revolutionizing Sports Training - Ohio ...,Perhaps the most important byproduct of technology in sports training is that injuries have been severely reduced and now can be identified much earlier.,['sport tech']
20 Ways Technology Makes Sports Better | Bleacher Report,"Technology helps athletes, both amateur and professional, find out what is wrong with a particular part of their game, and helps them fix it. It is a¬†...",['sport tech']
Top 5 Sports Tech News ‚Äì Feb 2021,"Mar 10, 2021 ‚Äî Welcome to the top5 sports tech news of Feb 2021. In this edition, we cover a game-changing use of technology that is super impactful for¬†...",['sport tech']
"Sports Technology: The Good, the Bad, and the Ugly","Speed timing gates, motion capture systems, force plates, velocity-based training tools, athlete management systems, online programming platforms, and injury¬†...",['sport tech']
Sports Technology - CES 2022,"Discover how technology is changing the business of sports through enhancing athletic performance, smart arenas, esports and next-generation sponsorships.",['sport tech']
How Technology in Sport is Changing the Game | Technogym,"The use of technology in sports is growing rapidly. In football, for instance, new devices are used for different reasons such as to help referees in¬†...",['sport tech']
Sport Technology - Google Books Result,"Stewart Ross ¬∑ 2010 ¬∑ ‚ÄéJuvenile NonfictionSee it again The video replay is a key element of the modern sporting scene. ... technology has introduced another, more controversial element to sport¬†...",['sport tech']
Sport Technology Systems -,"TO TRAIN AND PLAY. Christian Sist, CEo. CONTENT. We create unique content, based on science, pushing your limits¬†...",['sport tech']
Synergy Sports: Home,Our vision is for global sports at every level to have the content and technologies to raise their game and create a more immersive experience.,['sport tech']
Sport Technology Jobs - 2022 | Indeed.com,"Apply to Sport Technology jobs now hiring on Indeed.com, the worlds largest job site.",['sport tech']
Sport Technology - Domains of innovation ‚Äê EPFL,"Sport Technology. Performance, Health and Entertainment. Sports innovations don't just boost athletes' performance, they can improve everyone's life.",['sport tech']
Sport technology: A commentary | Request PDF - ResearchGate,"The sports industry in all its fields is increasingly in need of technology to facilitate its proper performance (2) . Today, technological innovations seem to¬†...",['sport tech']
Sports Technology Ltd | LinkedIn,Sports Technology Ltd | 600 followers on LinkedIn. The team behind Sport Technology have unprecedented experience designing AV solutions for major¬†...,['sport tech']
"Study Sports Technology, Subjects, University of Otago, New ...","How does technology enhance sporting performance? With advanced analysis tools, hi-tech sportswear, innovative design in training equipment and programmes, and¬†...",['sport tech']
Fusion Sport | Human Performance Technology,Fusion Sport is the developer of the Smartabase Human Performance Platform and Athlete Management System and Smartspeed Timing Gate Systems.,['sport tech']
Technology and Innovation | Australian Institute of Sport,The Australian Sports Commission recognises the outstanding contribution that Aboriginal and Torres Strait Islander people make to society and to sport in¬†...,['sport tech']
Technology in Sport: Three Ideal-Typical Views and Their ...,"by S Loland ¬∑ 2003 ¬∑ Cited by 108 ‚Äî Technology that requires athletic efforts and skills, to which there is equal access, and that. Sigmund Loland | Technology in Sport | www.idrottsforum.org |¬†...11 pages",['sport tech']
Sport technology: A commentary - NCBI,by V Ratten ¬∑ 2020 ¬∑ Cited by 21 ‚Äî The sport industry is increasingly being influenced by technology innovation for its global competitiveness. Technology is evident in sport¬†...,['sport tech']
20 sports tech ideas to invest in now - Class of 2020 - SportsPro,"Jan 31, 2020 ‚Äî The global sports tech ecosystem is awash with early-stage companies and ... sports, gaming, content production and in-venue technology has¬†...",['sport tech']
Merge Sport | How technology will revolutionise sport for fans,Merge Sport | How technology will revolutionise sport for fans. Launch of first ever Fuse publication looks to the future of the sports experience for fans¬†...,['sport tech']
Sports Technology Institute | Loughborough University,"Engineering Sport. We have a vision that technology can enhance the experience, performance and safety of anyone involved in sport.",['sport tech']
Ascend Sport Technology - Crunchbase Company Profile ...,"Ascend creates sports technology companies by leveraging cutting-edge technologies such as AI, digital targeted advertising, and big data.",['sport tech']
The Use of Applied Technology in Team Sport - Routledge,"The use of technology within sport is well established, most professional sport teams engage in the use of electronic performance and tracking systems.",['sport tech']
Global Sport Technology,"Welcome to the site of the Global Sport Technology, Inc. (GST) ... and training equipment as well as training software to reach quality in live and sport.",['sport tech']
sport-technology.si,WE GUARANTEE THE OPTIMAL CONDITIONS FOR THE TRAINING IN ALL SPORT BRANCHES. We are a specialised company in the area of sport infrastructure.,['sport tech']
Women in Sports Tech,Women in Sports Tech is the non-profit driving transformative growth opportunities for women at all stages of their careers throughout the sports tech and¬†...,['sport tech']
The Evolution of Technology & Sports,"Nov 13, 2018 ‚Äî Throughout the past 200 years, technology and technological advancements in the sporting world has been prevalent. Within sports, technology¬†...",['sport tech']
Sport Industry: The impact of technology on sport - Online ...,Technology in Sport ¬∑ Analysis of sport performance and enabling coaches to greatly improve the quality of feedback to players/athletes ¬∑ Increase accuracy in¬†...,['sport tech']
Sport and technology ‚Äì An actor-network theory perspective,"by R Kerr ¬∑ 2016 ¬∑ Cited by 37 ‚Äî We now utilise a range of interconnected technologies at work, at home and at leisure. The realm of sport is no exception, where new ... Show More.",['sport tech']
"Sport technology ‚Äì News, Research and Analysis - The ...","Articles on Sport technology ¬∑ Nike Vaporfly ban: why World Athletics had to act against the high-tech shoes ¬∑ Wafer-thin bicycles, speedy shorts, go-faster¬†...",['sport tech']
Sport and technology ‚Äì An actor-network theory perspective,"by R Kerr ¬∑ 2016 ¬∑ Cited by 37 ‚Äî We now utilise a range of interconnected technologies at work, at home and at leisure. The realm of sport is no exception, where new ... Show More.",['sport tech']
"Sport technology ‚Äì News, Research and Analysis - The ...","Articles on Sport technology ¬∑ Nike Vaporfly ban: why World Athletics had to act against the high-tech shoes ¬∑ Wafer-thin bicycles, speedy shorts, go-faster¬†...",['sport tech']
LYCRA¬Æ SPORT technology | Certified performance,"Why choose LYCRA¬Æ SPORT technology? The challenge: Consumers are increasingly demanding activewear that optimizes performance, but comfort is often neglected.",['sport tech']
20 sports tech ideas to invest in now - Class of 2020 - SportsPro,"Jan 31, 2020 ‚Äî The global sports tech ecosystem is awash with early-stage companies and ... sports, gaming, content production and in-venue technology has¬†...",['sport tech']
Sport and technology: An actor-network theory perspective,by R Kerr ¬∑ 2016 ¬∑ Cited by 1 ‚Äî How do new technologies come to be used in sport? This book moves beyond the idea of functionality to explore the many other important factors that athletes¬†...,['sport tech']
Master in Sport Technologies and Digital Transformation Madrid,"This pioneering and unique program answers the sport industry's need for qualified profesionals in new technologies and digital transformation.Mon, Oct 24Master in Sport Technologies ...",['sport tech']
Should Technology in Sports Be Limited? - The Cal Connection,"Mar 23, 2021 ‚Äî With the technological world constantly advancing, the questions of whether technology should be evolving in the industry of sports is a¬†...",['sport tech']
Digital Transformation and Future Changes in the Sports ...,"Why technological changes are important in sports. Digital technology is unlocking unprecedented opportunities for growth in the sports industry, offering the¬†...",['sport tech']
Six Technological Advancements That Have Changed Sports,"Jul 18, 2016 ‚Äî Six Technological Advancements That Have Changed Sports ¬∑ Hawk-Eye Technology ¬∑ HANS device ¬∑ Video Technology ¬∑ Wearable Computers ¬∑ Prosthetic¬†...",['sport tech']
The Impact of Technology on Sport II 1st Edition - Amazon.com,"The Impact of Technology on Sport II [Fuss, Franz Konstantin, Subic, Aleksandar, Ujihashi, Sadayuki] on Amazon.com. *FREE* shipping on qualifying offers.",['sport tech']
The Impact of Technology on Sport II 1st Edition - Amazon.com,"The Impact of Technology on Sport II [Fuss, Franz Konstantin, Subic, Aleksandar, Ujihashi, Sadayuki] on Amazon.com. *FREE* shipping on qualifying offers.",['sport tech']
Advantages and disadvantages of technology - BBC,Learn about and revise technology in sport with this BBC Bitesize GCSE PE (WJEC) study guide.,['sport tech']
Smart Sports - Carnegie Mellon University | CMU,"A New Course in Sports Technology. Sports Technology. As you run, your playlist matches the next song with your tempo; your tennis racket offers tips on how to¬†...",['sport tech']
Masters Degrees in Sport technology - FindAMasters,"Results 1 - 15 of 92 ‚Äî Are you looking for a Masters degree in Sport Technology? Compare postgraduate programmes and find out about course content,¬†...",['sport tech']
SMT (SportsMEDIA Technology),"SMT's broadcast and on-site solutions play an integral role in the world's most prestigious sporting and entertainment events, providing producers with¬†...",['sport tech']
How is technology affecting sport? - Oxford University Press,"Technology plays a major role in sport: it has changed the way athletes perform, the way professional sports are officiated, and the way fans watch the game¬†...",['sport tech']
Sport Technology - Stewart Ross - Google Books,"Sports Technology looks at developments in the world of sport, and explores the way in which technology has enhanced both the players and the supporters¬†...",['sport tech']
20 sports tech ideas to invest in now - Class of 2020 - SportsPro,"Jan 31, 2020 ‚Äî The global sports tech ecosystem is awash with early-stage companies and ... sports, gaming, content production and in-venue technology has¬†...",['sport tech']
rogue sport advanced technology - Nissan USA,"Explore the technology of the 2022 Nissan Rogue Sport. The Rogue Sport features smartphone connectivity with Apple Carplay and Android Auto,¬†...",['sport tech']
Sports Tech World Series: STWS Home,The Sport Tech Annual is an industry publication with expert industry insights and a comprehensive directory of key companies in sports tech. Read Now.,['sport tech']
"International Workshop on Sport, Technology and Research","The 2022 IEEE International Workshop on Sport, Technology and Research will be held in Cavalese (Italy) from 13 to 15 July 2022.",['sport tech']
How can technology protect and improve the future of sport?,"Feb 17, 2021 ‚Äî And while this trend was always likely to increase, the pandemic may lead to sports teams utilising wearable tech as a method of ensuring health¬†...",['sport tech']
The Psychology of Endurance-Sport Technology,"Oct 26, 2021 ‚Äî Endurance-sport technology has a major psychological impact. A good smart training watch produces data that can change the way we think,¬†...",['sport tech']
MSc Sports Technology | KTH | Sweden,"Technically, Sports Technology focuses on the measurement, simulation, and motion and performance analysis. The programme consists of traditional engineering¬†...",['sport tech']
The sports tech that actually makes you faster by Precision ...,Dr Bryce Dyer explores some of the current technological innovations in sport to see if they really can give you a performance gain...,['sport tech']
9 Game-Changing Ways Technology Benefits Sports,"Mar 28, 2021 ‚Äî Technology has changed sport in so many ways, from instant replay technology to gaming. How many benefits have you noticed?",['sport tech']
Sport Management | WVU Tech Admissions | West Virginia ...,"Intern with a team, athletic department, sporting goods company or outdoor recreation organization. There's more to sport than the game on the court or field¬†...",['sport tech']
15 innovations pushing human performance to the limit,"Jul 19, 2016 ‚Äî Sport science and technology are helping athletes ‚Äì professional and amateur ‚Äì to optimise their physical output. WIRED explains how.",['sport tech']
Why technology has a powerful impact on sport today,"Dec 5, 2019 ‚Äî With that being said, how exactly did technology change the sports industry for the better? Improved athlete training. Athletes need more than¬†...",['sport tech']
STA Access Innovation - Sports Tech Group,Technology is the single greatest force changing every aspect of sport. ... coaching on the most relevant and important technologies impacting sports¬†...,['sport tech']
LYCRA¬Æ SPORT technology | Certified performance,"Why choose LYCRA¬Æ SPORT technology? The challenge: Consumers are increasingly demanding activewear that optimizes performance, but comfort is often neglected.",['sport tech']
How Sport Technology Will Impact the 2016 Olympic Games,"Aug 4, 2016 ‚Äî Sport technology devices like AR glasses, VR headsets and custom wearables are helping athletes at this year's Olympic Games in Rio.",['sport tech']
Integrative Center for Athletic and Sport Technology: Home,"An interdisciplinary center drawing on expertise in engineering, kinesiology, health science and athletic training, the Integrative Center for Athletic and¬†...",['sport tech']
Sport Technology - ResearchSpace,"by T Kirkbride ¬∑ 2007 ‚Äî Tony Kirkbride, Head: CSIR Technology Centre said there are a variety of sports technologies and there have been advances in material sciences and advances¬†...",['sport tech']
The 5 Best Sport Technology Providers That understand The ...,Mirror Review's latest magazine issue of ‚ÄúThe Top Cutting Edge Sport Technology Solution Providers 2019‚Äù provide latest sport tech knowldge.,['sport tech']
Sport Technology - Stewart Ross - Google Books,"Sports Technology looks at developments in the world of sport, and explores the way in which technology has enhanced both the players and the supporters¬†...",['sport tech']
Sport Technology Final Review Questions - Quizlet,"Start studying Sport Technology Final Review Questions. Learn vocabulary, terms, and more with flashcards, games, and other study tools.",['sport tech']
From a Technology That Replaces Human Perception‚ÄìAction ...,"by CT Woods ¬∑ 2021 ¬∑ Cited by 1 ‚Äî Information technology has been integrated into most areas of sport, providing new insights, improving the efficiency of operational¬†...",['sport tech']
Journal of Advanced Sport Technology,"Journal of Advanced Sport Technology (JAST) Keywords New Ball, Corona Virus, Volleyball, Nanosilver Overtraining Syndrome, Football Technology, Heart Rate.",['sport tech']
"Technology Sport, m√°quinas lanzapelotas, siboasi, redes ...","Technologysport es una tienda on line para productos deportivos para la ense√±anza, la practica y el aprendizaje del tenis y el padel.",['sport tech']
Playing by New Rules: How Sports Tech is Changing the Game,"Mar 1, 2020 ‚Äî How is technology changing the game for sports teams and their fans worldwide? On February 21, 2020, experts from across the professional¬†...",['sport tech']
Power Sports Technology | TCAT Hohenwald,The mission of the Power Sports Technology program is to prepare students with a thorough understanding of the methods of servicing and repair of power¬†...,['sport tech']
Certificate in Technology and Science Applied to Sport - Barca ...,"Xavier Reche ¬∑ Tracking and monitoring sports scientist at FC Barcelona. ¬∑ Angel Ric ¬∑ Phd in Sport Science. ¬∑ Ra√∫l Pel√°ez ¬∑ Head of Sports Technology, Innovation &¬†...",['sport tech']
Why technology has a powerful impact on sport today,"Dec 5, 2019 ‚Äî With that being said, how exactly did technology change the sports industry for the better? Improved athlete training. Athletes need more than¬†...",['sport tech']
Integrative Center for Athletic and Sport Technology: Home,"An interdisciplinary center drawing on expertise in engineering, kinesiology, health science and athletic training, the Integrative Center for Athletic and¬†...",['sport tech']
Master Master's degree programs Sports Technology - FH ...,"The master's degree program Sports Equipment Technology is a one-of-a-kind course that combines technology, sport, and business. ‚û® Learn more.",['sport tech']
Sport Technology Sales Representative jobs - Indeed,"9959 Sport Technology Sales Representative jobs available on Indeed.com. Apply to Sales Representative, Inside Sales Representative,¬†...",['sport tech']
LYCRA¬Æ SPORT technology | Certified performance,"Why choose LYCRA¬Æ SPORT technology? The challenge: Consumers are increasingly demanding activewear that optimizes performance, but comfort is often neglected.",['sport tech']
2022 Ford Bronco‚Ñ¢ Sport SUV | Technology Features,Take tech for the trail with the 2022 Ford Bronco‚Ñ¢ Sport SUV intelligent technology features. See an 8-inch touchscreen with standard connected technology¬†...,['sport tech']
Boost - The Sports AI Engine,"sports-illustrated ¬∑ yahoo-sports ... Engage Fans. Tell unique, relevant, and personalized sports stories for fans. ... Boost Technology Inc.",['sport tech']
"Sportech, Inc.: OEM Product Development & Plastic ...","WORLD CLASS DESIGN. WORLD CLASS MANUFACTURING. ... From our humble beginnings more than 20 years ago, Sportech has evolved to become a recognized leader in the¬†...",['sport tech']
Sportech PLC ‚Äì The international betting technology business,"Sportech PLC is a trusted participant in the global gaming technology sector, providing technology and service solutions for lotteries and gaming companies and¬†...",['sport tech']
sportech.net,"Sportech is the largest independent, international provider of pari-mutuel solutions to the global betting industry; provider of award-winning Lottery platforms¬†...",['sport tech']
Sportech Inc. | LinkedIn,"At Sportech, we are experts at designing and manufacturing comprehensive accessory product portfolios that help our customers and end-users get more from¬†...",['sport tech']
Sportech LLC - Home | Facebook,"Sportech is an innovation-driven OEM plastics thermoformer specializing in the design, development... 10800 175th Ave NW, Elk River, MN 55330.",['sport tech']
Sportech Rye Brook,"Sportech provides the Greenwich, CT & White Plains, NY areas with high-quality running sneakers as well as tennis & soccer equipment.",['sport tech']
Sportech - Wikipedia,Sportech PLC is an online gambling and entertainment company headquartered in the United Kingdom. The company is traded on the London Stock Exchange under¬†...,['sport tech']
"Sportech, LLC Company Profile | Elk River, MN","Company Description: Sportech, LLC is located in Elk River, MN, United States and is part of the Motor Vehicle Parts Manufacturing Industry.",['sport tech']
Sports Betting for CT | Powered by Sportech,Sports Betting is here Connecticut. Visit a Winners OTB location or Bobby V's Restaurant & Sports Bar nearest you to get in on the action.,['sport tech']
"Athena Sportech: outdoor, sport & tech products","We operate mainly in consumer electronics, sport, off-road motorcycles, and in the online and B2B world through loyalty programmes. Athena Sportech is not just¬†...",['sport tech']
Sportech: Sport Accessories for Vehicles,"Importer and distributor of sports car accessories ... Prestigious brands such as Bilstein, Koni, Eibach, K&N or OMP Racing rely on Sportech for the importation¬†...",['sport tech']
Sportech | Investment | Monomoy Capital Partners,"Sportech is a leading designer, manufacturer, and assembler of cab components and assemblies for a wide range of OEM customers.",['sport tech']
INSPIRED ANNOUNCES ACQUISITION OF SPORTECH ...,"Jan 4, 2022 ‚Äî L). The principal asset of Sportech Lotteries is the lottery systems contract to provide online and retail lottery services, as well as the¬†...",['sport tech']
"Sportech PLC (SPO.L) Stock Price, News, Quote & History","Find the latest Sportech PLC (SPO.L) stock quote, history, news and other vital information to help you with your stock trading and investing.",['sport tech']
SPORTECH: Home,Our Collections ¬∑ Martial Arts ¬∑ Gymnastics ¬∑ Fitness & Gym ¬∑ Parkour ¬∑ Crossfit ¬∑ Play corner¬†...,['sport tech']
Sportech - Royal Oak Realty Trust,"Dec 22, 2021 ‚Äî On December 22, 2021, Royal Oak acquired the manufacturing and warehouse facility of Sportech, LLC (‚ÄúSportech‚Äù) located in Elk River, MN.",['sport tech']
Sportech: Portland Commercial & Residential Synthetic Turf ...,"Sportech Construction & Excavation Offers Residential Synthetic Grass & Commercial Artificial Turf in McMinnville, OR.",['sport tech']
Sportech - Walmart,"Shop for Sportech . Buy products such as Sportech 42101022 Tank Pad - Argyle, Sportech 20321010 Skid Plate - Black at Walmart and save.",['sport tech']
ROD.L - Sportech plc Profile | Reuters,The Sportech Lotteries segment provides lottery software and services worldwide. Sportech Venues is engaged in off-track betting venue management. Its key¬†...,['sport tech']
"Working at Sportech, Inc.: 19 Reviews - Indeed","Reviews from Sportech, Inc. employees about Sportech, Inc. culture, salaries, benefits, work-life balance, management, job security, and more.",['sport tech']
Working at Sportech | Glassdoor,"See what employees say it's like to work at Sportech. Salaries, reviews, and more - all posted by employees working at Sportech.",['sport tech']
Sportech - Sports: Sports & Outdoors - Amazon.com,"Online shopping for Sports & Outdoors from a great selection of Clothing, Exercise & Fitness, Accessories, Hunting & Fishing, Team Sports,¬†...",['sport tech']
Sportech / Join Us MN,"With help from the Job Creation Fund, Sportech plans to expand their Elk River facility and create 85 new jobs over the next three years. Are you ready to build¬†...",['sport tech']
Sportech leader Taylor 'exasperated' by Lamont's sports ...,"By Tuesday night, Sportech was threatening to sue the state, following an announced deal on sports betting and online casino gaming between Gov.",['sport tech']
