titles,summaries,terms
Sportech - Dennis Kirk,"Results 1 - 6 of 6 ‚Äî Shop for Sportech items at Dennis Kirk. Best selection, lowest prices, plus orders over $89 ship free. We Ship Today!",['sport tech']
SPORTECH | Buy Now affordable quality digital watches ...,"Bold, durable, built to resist any adventure. SPORTECH digital watches designed for sports and adventure. Water resistant up to 3ATM/30M.",['sport tech']
SportechPLC - Twitter,"Sportech is the International Betting Technology Business. ... Sportech Delivers Commingling Services, Digital Platform Under New Agreement with UK Tote¬†...",['sport tech']
"Sportech - Rye Brook, NY - Yelp","7 reviews of Sportech ""I have been a runner for years and I love coming here to get shoes. They can be a little pricey but I find that they have the best¬†...",['sport tech']
Sportech (@sportech.es) ‚Ä¢ Instagram photos and videos,"4566 Followers, 250 Following, 592 Posts - See Instagram photos and videos from Sportech (@sportech.es)",['sport tech']
SPORTECH - Flux Sunglasses,Sportech shades are also lightweight and flexible so the frames flex with you as you perform. WHAT'S IN THE BOX 1 x FLUX Sportech Sunglasses 1.,['sport tech']
"Sportech - Overview, News & Competitors | ZoomInfo.com","View Sportech (www.sportechplc.com) location in Bristol, United Kingdom , revenue, industry and description. Find related and similar companies as well as¬†...",['sport tech']
Sportech Racing LLC - Company Profile and News,"Sportech Racing, LLC supports gambling operations. The Company offers gaming systems for race-tracks, off-track betting networks, internet betting operators¬†...ADDRESS: 1500 Bluegrass Lakes Parkway Al...",['sport tech']
Welcome to Sportech Sails - Sportech Sails - Custom Sails ...,"Since 1976 Sportech Sails has been Niagara Regions leader in custom marine canvas and sails. Over the years we have been building Dodgers, Biminis, Sails,¬†...",['sport tech']
Sportech agrees 10-year commercial deal to offer sports ...,"Aug 13, 2021 ‚Äî Having been unable to secure a sports betting license for the state of Connecticut, betting technology firm Sportech has instead announced¬†...",['sport tech']
Products from Sportech - Tracks USA,"Products from Sportech. Sort By. Best Match, Recommended, Price: Low to High, Price: High to Low, Popularity. Refine Search Options.",['sport tech']
Sportech - Crunchbase Company Profile & Funding,"Sportech plc is one of the gaming companies, providing a variety of gaming opportunities.",['sport tech']
SporTech Donates Backpacks to ISD 728,Longtime ISD 728 partner SporTech made Back-to-School a bit sweeter for students across the district...,['sport tech']
SPORTECH PLC SPO Stock,"SPORTECH PLC SPO Company page - Search stock, chart, recent trades, company information, trading information, company news, fundamentals.",['sport tech']
Sportech PLC - AnnualReports.com,"Spanning B2B and B2C, Sportech customers range from large gaming enterprises to charitable foundations conducting raffles at sporting events, to fans having a‚Ä¶",['sport tech']
Sportech Inc. | Manufacturing | Engineers - Elk River Chamber ...,We are experts at designing and manufacturing comprehensive accessory product portfolios that help our customers and end-users get more from their vehicles and¬†...,['sport tech']
Sportech - Crunchbase Company Profile & Funding,"Sportech plc is one of the gaming companies, providing a variety of gaming opportunities.",['sport tech']
Sportech Crew Plastic Top | Intimidator UTV,Sportech Crew Plastic Top. Click Images to Enlarge. The Intimidator side by sides are built tough to make work around the farm or job site easier.,['sport tech']
"SPO: Sportech PLC - Stock Price, Quote and News - CNBC","Get Sportech PLC (SPO:London Stock Exchange) real-time stock quotes, news, price and financial information from CNBC.",['sport tech']
Sportech Engineering: Home,SPORTECH is an engineering services provider and a world leading supplier of motorsport and high-performance vehicles power steering systems.,['sport tech']
Inspired moves into lottery vertical through Sportech Lotteries ...,"Jan 4, 2022 ‚Äî Inspired Entertainment has acquired Sportech's lottery technology division for an initial consideration of $12.5m (¬£9.3m/‚Ç¨11.1m).",['sport tech']
Inspired Entertainment acquires Sportech Lotteries for $12.5M,"Jan 4, 2022 ‚Äî Inspired Entertainment (INSE) has acquired Sportech Lotteries, a subsidiary of Sportech PLC (SPOZF)",['sport tech']
Sportech (UK) Company Profile: Stock Performance & Earnings,"Sportech PLC is a sports entertainment company and pool betting organizations, focusing on regulated markets worldwide. The company has three business¬†...",['sport tech']
Sportech - iPayables: AP Automation,"Invoice access for Sportech through iPayables, Inc. If you need help with the activation process or invoice submission, let us know.",['sport tech']
Sportech Windshields for sale | eBay,Get the best deals on Sportech Windshields when you shop the largest online selection at eBay.com. Free shipping on many items | Browse your favorite brands¬†...,['sport tech']
GMZ Racing Sportech XC | Discount Tire,The GMZ Sportech XC (Cross Country) is a 6 ply ATV tire designed for sport ATV's. This versatile tread features the Sportech logo on the sidewall with a¬†...,['sport tech']
Industry supplier Sportech acquired by private equity firm,"Dec 2, 2019 ‚Äî Monomoy Capital Partners has completed the acquisition of Sportech, Inc., the Minnesota-based leading supplier of cab components for¬†...",['sport tech']
"Sportech plc (SPOZF) Stock Price, Quote, News & History",Sportech plc (SPOZF) Stock Quotes - Nasdaq offers stock quotes & market activity data for US and global markets.,['sport tech']
Average Salary for Sportech Inc. Employees - Payscale,"Feb 9, 2022 ‚Äî The average salary for Sportech Inc. employees is $72572 per year. Visit PayScale to research Sportech Inc. salaries, bonuses, reviews,¬†...",['sport tech']
Sportech - CB Insights,"Sportech is a player in the global pari-mutuel betting technology sector. It provides technology solutions for gaming companies, sports teams,¬†...",['sport tech']
"Sportech PLC, SPO:LSE summary - FT.com - Markets data","Latest Sportech PLC (SPO:LSE) share price with interactive charts, historical prices, comparative analysis, forecasts, business profile and more.",['sport tech']
Sport Tech Store,"Amazing selection of top fashion brands: clothing, footwear and accessories.",['sport tech']
Sportech Indoor Golf | Home,"Opened in 2019, Sportech Indoor Golf has been the place for entertainment for all the golf lovers in Calgary. With the newest technology, our golf¬†...",['sport tech']
About us - Sportec Solutions,"Leading innovation in match data analysis and sports technology. About us. As a joint venture between Deltatre and DFL Group, headquartered in Munich, Sportec¬†...",['sport tech']
Sportech | Economic Development | Decklan Group,"Sportech and its parent company, Envision Companies, approached Decklan Group with a desire to expand their wildly successful motor sports accessory¬†...",['sport tech']
Sportech Motorcycle Windscreens | ChapMoto.com,Browse our huge selection of Sportech Motorcycle Windscreens for the lowest price on Sportech. No Hassle Returns. No Restock Fees.,['sport tech']
Sportech | SnowGoer,Sportech Speedguard Hand Guards Review ¬∑ Read more ¬∑ Sportech Speedguard Handguards ¬∑ Read more. Follow us. Fantasy Snocross. Popular; Recent; Comment¬†...,['sport tech']
Sportech Venues could get boost from sale involving parent ...,"Dec 3, 2020 ‚Äî Sportech Venues, the company licensed to operate Connecticut's off-track betting locations and which seeks to provide sports wagering in the¬†...",['sport tech']
"Sportech looking for new OTB sites in Bridgeport, two other cities","Mar 1, 2021 ‚Äî Sportech Venues Inc., which is the exclusive licensee of Connecticut's off-track betting system, is launching a professional site search as¬†...",['sport tech']
Sportech Dress - FINAL SALE - Peachy Tan,"Sportech is our latest ahtletic fit collection in a very soft, smooth and lightweight meryl jersey. This season's collection includes a classic color-block¬†...",['sport tech']
Sportech Headlines - Page 1 of 1 - BloodHorse,"Sportech Racing and Digital has been selected to provide pari-mutuel betting technologies and services to Dansk Hestev√¶ddel√∏b ApS, the joint operating¬†...",['sport tech']
Sportech Unveils Tender Offer for Buying $49.2M in Shares,"Aug 9, 2021 ‚Äî Sportech has announced the launch of a proposed tender aiming to return up to $49.2 million to shareholders.",['sport tech']
SPO | Sportech PLC Stock Price & News - WSJ,Sportech Plc engages in the pari-mutuel betting and supply of wagering technology solutions. It operates through the following segments: Sportech Lotteries;¬†...,['sport tech']
Meritex Announces Acquisition of Sportech Building,"May 19, 2016 ‚Äî MINNEAPOLIS, MN--(Marketwired - May 19, 2016) - The Meritex Company today announced the acquisition of the Sportech Building,¬†...",['sport tech']
"Sportech 124 S Ridge St Port Chester, NY Rubber & Plastic ...","Sportech is a retail store specializing in athletic footwear and apparel for the entire family. Tennis specialty, running and fitness are our specialty. Let our¬†...",['sport tech']
Sportech sells interest in lottery contract to Inspired ...,"Jan 4, 2022 ‚Äî Betting technology group Sportech has completed the sale of its Dominican Republic lottery contract to Inspired Entertainment for¬†...",['sport tech']
Working At Sportech: Employee Reviews and Culture - Zippia,"Dec 14, 2021 ‚Äî The company is 36.6% female and 31.5% ethnic minorities. Despite its diversity in other areas, Sportech employees are noticeably lacking in¬†...",['sport tech']
Sportech | Belt-tech,Sportech. We align ourselves with Major Suppliers in the Sportswear Industry. Rock climber rappelling. Product Characteristics :.,['sport tech']
Sportech Rebuffs $71 Million Takeover Bid from Standard ...,"Nov 6, 2020 ‚Äî Sportech confirms it has twice rebuffed all-cash takeover bids from US hedge firm Standard General that valued it at $71 million.",['sport tech']
Sportech agrees sale of Global Tote to Betmakers for ¬£31m,"Dec 1, 2020 ‚Äî Bristol-based betting technology firm Sportech has entered into a conditional agreement to sell its Global Tote business to Betmakers¬†...",['sport tech']
Sportech: opening hours & services | Rossignol,"Discover Sportech on the official website: sports & ski wear, urban wear, technical equipment & bikes!",['sport tech']
Inspired Entertainment acquires Sportech Lotteries for $12.5m,"Jan 4, 2022 ‚Äî Inspired said the principal asset of Sportech Lotteries is the lottery systems contract to provide online and retail lottery services, as well¬†...",['sport tech']
Inspired Entertainment acquires Sportech Lotteries for $12.5m,"Jan 4, 2022 ‚Äî Inspired said the principal asset of Sportech Lotteries is the lottery systems contract to provide online and retail lottery services, as well¬†...",['sport tech']
Sportech PLC Company & People | SPO | Barron's,6 days ago ‚Äî The Sportech Lotteries segment provides lottery software and services worldwide. The Sportech Venues segment offers off-track betting venue¬†...,['sport tech']
Leads Retail ¬ª Sportech - Rye Ridge Shopping Center,"SPORTECH, an athletic footwear, apparel and equipment store, provides ladies, kids and men with running, tennis, squash, fitness, yoga, Pilates, basketball,¬†...",['sport tech']
LONGTIME BUSINESS: Sportech Still at Peak Performance,"Jul 19, 2013 ‚Äî A cornerstone of the vibrant Rye Ridge Shopping Center, Sportech has been on the cutting edge of the fitness market for 22 years.",['sport tech']
Sportech sells Leidsa lottery contract to Inspired for $14.5m,"Jan 4, 2022 ‚Äî Sportech has announced the sale of its contract for the supply of lottery systems to Leidsa to Inspired in a deal worth up to $14.5m.",['sport tech']
Progress MN: Sportech Inc. | Finance & Commerce,"Apr 8, 2016 ‚Äî Elk River-based Sportech has spent more than two decades becoming a business fixture in that northwest suburb and solidified that status¬†...",['sport tech']
20 Best sportech jobs (Hiring Now!) | SimplyHired,"29 sportech jobs available. See salaries, compare reviews, easily apply, and get hired. New sportech careers are added daily on SimplyHired.com.",['sport tech']
BetMakers acquires Sportech to accelerate international growth,"Jun 18, 2021 ‚Äî The acquisition covers Sportech's racing, tote and digital assets in the US, UK and Europe, widening the operator's international customer base,¬†...",['sport tech']
Sportech PLC (SPO) Quote - XLON | Morningstar,"Sportech PLC is a sports entertainment company and pool betting organizations, focusing on regulated markets worldwide. The company has three business¬†...",['sport tech']
Meritex Announces Acquisition of Sportech Building,"May 19, 2016 ‚Äî MINNEAPOLIS, MN--(Marketwired - May 19, 2016) - The Meritex Company today announced the acquisition of the Sportech Building,¬†...",['sport tech']
"Global Fantasy Sports Market (2022 - 2027): DraftKings, NFL ...","2 days ago ‚Äî Global Fantasy Sports Market (2022 - 2027): DraftKings, NFL Fantasy, Sportech, and Fantasy Feud Dominate - ResearchAndMarkets.com.",['sport tech']
Sportech Rebuffs $71 Million Takeover Bid from Standard ...,"Nov 6, 2020 ‚Äî Sportech confirms it has twice rebuffed all-cash takeover bids from US hedge firm Standard General that valued it at $71 million.",['sport tech']
"Sportech Venues, Inc. to provide exclusive online wagering in ...","The approval was granted under Sportech's existing exclusive license to provide pari-mutuel wagering on horse racing, greyhound racing and jai alai in¬†...",['sport tech']
‚Äì Sportech,info@sportech.es. Siguenos. Facebook ¬∑ Twitter ¬∑ Instagram ¬∑ YouTube. Atr√°s. Equipamiento Coche; Amortiguadores/Suspensiones; Asientos; Volantes; Arneses,['sport tech']
"Sport-Tech Construction - Tennis Courts, Football Fields ...","Sport-Tech Construction is the premier construction and maintenance firm in New York, Connecticut, and New Jersey for athletic fields, running tracks, tennis¬†...",['sport tech']
"Spotrac.com: Sports Contracts, Salaries, Caps, Bonuses ...","NFL, MLB, NBA, NHL, MLS, EPL, contract breakdowns, yearly salaries, team salary caps and more.",['sport tech']
BetMakers appoints Anna Massion to board of directors,2 days ago ‚Äî BetMakers revenue soars after integrating Sportech assets. 11th February 2022. BetMakers strengthens Board with appointment of Rebekah Giles.,['sport tech']
Nissan wins three Car of the Year 2022 awards - Automotive ...,"6 days ago ‚Äî Nissan in Thailand won three prestigious 'Car of the Year 2022' awards including the Nissan Almera Sportech VL as Best Sedan under 1000 cc,¬†...",['sport tech']
Global Fantasy Sports Software and Platforms Market Size ...,"6 days ago ‚Äî ... Roto Sports, Inc., Fantrax, Good Gamer Corporation, Nfl Enterprises LLC, Draftkings Inc., Sportech Inc., Fanduel, Dream Sports.",['sport tech']
SPORTECH Smart Sensor Technology and Connected Fabrics,"Nov 12, 2018 ‚Äî SPORTECH Smart Sensor Technology and Connected Fabrics ¬∑ Sponsor: Gryppers, Inc. ¬∑ Team Members: Lauren Anderson, Tyler Eller, Anna Matthews,¬†...",['sport tech']
‚Äì Sportech,info@sportech.es. Siguenos. Facebook ¬∑ Twitter ¬∑ Instagram ¬∑ YouTube. Atr√°s. Equipamiento Coche; Amortiguadores/Suspensiones; Asientos; Volantes; Arneses,['sport tech']
"Sport-Tech Construction - Tennis Courts, Football Fields ...","Sport-Tech Construction is the premier construction and maintenance firm in New York, Connecticut, and New Jersey for athletic fields, running tracks, tennis¬†...",['sport tech']
20 sports tech ideas to invest in now - Class of 2021 - SportsPro,"Feb 8, 2021 ‚Äî For the second year running, SportsPro presents its pick of sports tech startups and early-stage companies whose products and solutions¬†...",['sport tech']
BetMakers appoints Anna Massion to board of directors,2 days ago ‚Äî BetMakers revenue soars after integrating Sportech assets. 11th February 2022. BetMakers strengthens Board with appointment of Rebekah Giles.,['sport tech']
(eBay) Motorcycle Tyres Metzeler SPORTEC STREET 100/80 ...,(eBay) Motorcycle Tyres Metzeler SPORTEC STREET 100/80-17 52H & 140/70-17 66H Aprilia. ebaycouk. eBay.co.uk. 1M followers. More information¬†...,['sport tech']
Fantasy Car Racing Market to See Strong Growth Momentum,"4 hours ago ‚Äî ... Racing Market to See Strong Growth Momentum | Bovada, Sportech, Fantrax ... Bovada, Sportech, Fantrax, StarsDraft, Fantasy Feud & Ballr.",['sport tech']
"Spotrac.com: Sports Contracts, Salaries, Caps, Bonuses ...","NFL, MLB, NBA, NHL, MLS, EPL, contract breakdowns, yearly salaries, team salary caps and more.",['sport tech']
Nissan wins three Car of the Year 2022 awards - Automotive ...,"6 days ago ‚Äî Nissan in Thailand won three prestigious 'Car of the Year 2022' awards including the Nissan Almera Sportech VL as Best Sedan under 1000 cc,¬†...",['sport tech']
Global Fantasy Sports Software and Platforms Market Size ...,"6 days ago ‚Äî ... Roto Sports, Inc., Fantrax, Good Gamer Corporation, Nfl Enterprises LLC, Draftkings Inc., Sportech Inc., Fanduel, Dream Sports.",['sport tech']
"Liverpool Matches, Live Streams and Highlights at Totalsportek","Live Fixtures and Liverpool Streams on TotalSportek. Live Scores, Game Results, News, Tables& Player Stats.",['sport tech']
"Textiles Sportech An√°lisis De Mercado, Perspectivas De ...",4 days ago ‚Äî ¬øC√≥mo Ser√° El 2022 Para La Industria De Investigaci√≥n De Mercado De Textiles Sportech? A medida que nos enfrentamos a una pandemia que ha¬†...,['sport tech']
Major esports personnel changes in 2022 | Hitmarker,"8 days ago ‚Äî Chief Financial Officer, Sportech ‚Üí CEO, Tiidal Gaming. Michael Schwartz Director of Competitive Esports, Immortals Gaming Club ‚Üí Head of¬†...",['sport tech']
TotalSportek | Official reddit soccer streams,Total Sportek is a free soccer streaming website. You can watch all the matches here for free.,['sport tech']
"Ïò®ÎùºÏù∏ Î≤†ÌåÖ ÏãúÏû• Ï†ïÌôïÌïú Ï†ÑÎßù 2022 ‚Äì Betway, Betfred ...","Ïò®ÎùºÏù∏ Î≤†ÌåÖ ÏãúÏû• Ï†ïÌôïÌïú Ï†ÑÎßù 2022 ‚Äì Betway, Betfred, Interwetten, SBOBET, Sportech, EGB, BetOnline, DraftKings ¬∑ Tanmay Halaye | 3Ïõî 9, 2022.",['sport tech']
March√© Textiles Sportech 2022 Derni√®res opportunit√©s ...,"2 days ago ‚Äî March√© Textiles Sportech 2022 Derni√®res opportunit√©s commerciales, statistiques de croissance, part de l'industrie, taille,¬†...",['sport tech']
Í∏ÄÎ°úÎ≤å ÏàòÏòÅ ÏãúÍ≥Ñ ÏãúÏû• Ï°∞ÏÇ¨ Î≥¥Í≥†ÏÑú 2022ÎÖÑÎ∂ÄÌÑ∞ 2029ÎÖÑÍπåÏßÄ ...,"Í∏ÄÎ°úÎ≤å ÏàòÏòÅ ÏãúÍ≥Ñ ÏãúÏû• Ï°∞ÏÇ¨ Î≥¥Í≥†ÏÑú 2022ÎÖÑÎ∂ÄÌÑ∞ 2029ÎÖÑÍπåÏßÄ PASNEW, Sportech, iRapid. ÏàòÏòÅ ÏãúÍ≥Ñ. pratik 3Ïõî 5, 2022. 0. Ï†Ñ ÏÑ∏Í≥Ñ ÏàòÏòÅ ÏãúÍ≥Ñ ÏãúÏû• ÏòàÏ∏°Ïóê ÎåÄÌïú ÏµúÏã†¬†...",['sport tech']
Alberto Fern√°ndez se reuni√≥ con CEO de Eramet por ...,"7 days ago ‚Äî Leandro Alvarez ¬∑ Related Posts ¬∑ Oliver, la startup de sportech que da servicios de IA a los clubes/ Titulares ¬∑ Europa reconsidera su futuro¬†...",['sport tech']
TOTALSPORTEK - Best SoccerStreams,Best alternative to soccerstreams to feed of your live footy hunger. Fastest loading times and Top streamers links are ranked according to quality.,['sport tech']
Major esports personnel changes in 2022 | Hitmarker,"8 days ago ‚Äî Chief Financial Officer, Sportech ‚Üí CEO, Tiidal Gaming. Michael Schwartz Director of Competitive Esports, Immortals Gaming Club ‚Üí Head of¬†...",['sport tech']
TotalSportek | Official reddit soccer streams,Total Sportek is a free soccer streaming website. You can watch all the matches here for free.,['sport tech']
Ment√°ln√≠ tr√©nink v individu√°ln√≠ch sportech - Google Books Result,"Pavel Jan, Pavlov√° AlenaV√Ωsledkem spr√°vn√©ho napƒõt√≠ sval≈Ø p≈ôi m√≠ƒçov√Ωch hr√°ch jsou ƒçist√© a siln√© √∫dery, p≈ôi st≈ôelbƒõ je to p≈ôesnƒõj≈°√≠ mu≈°ka a ve v≈°ech sportech obecnƒõ je to snaz≈°√≠¬†...",['sport tech']
"Ïò®ÎùºÏù∏ Î≤†ÌåÖ ÏãúÏû• Ï†ïÌôïÌïú Ï†ÑÎßù 2022 ‚Äì Betway, Betfred ...","Ïò®ÎùºÏù∏ Î≤†ÌåÖ ÏãúÏû• Ï†ïÌôïÌïú Ï†ÑÎßù 2022 ‚Äì Betway, Betfred, Interwetten, SBOBET, Sportech, EGB, BetOnline, DraftKings ¬∑ Tanmay Halaye | 3Ïõî 9, 2022.",['sport tech']
March√© Textiles Sportech 2022 Derni√®res opportunit√©s ...,"2 days ago ‚Äî March√© Textiles Sportech 2022 Derni√®res opportunit√©s commerciales, statistiques de croissance, part de l'industrie, taille,¬†...",['sport tech']
Í∏ÄÎ°úÎ≤å ÏàòÏòÅ ÏãúÍ≥Ñ ÏãúÏû• Ï°∞ÏÇ¨ Î≥¥Í≥†ÏÑú 2022ÎÖÑÎ∂ÄÌÑ∞ 2029ÎÖÑÍπåÏßÄ ...,"Í∏ÄÎ°úÎ≤å ÏàòÏòÅ ÏãúÍ≥Ñ ÏãúÏû• Ï°∞ÏÇ¨ Î≥¥Í≥†ÏÑú 2022ÎÖÑÎ∂ÄÌÑ∞ 2029ÎÖÑÍπåÏßÄ PASNEW, Sportech, iRapid. ÏàòÏòÅ ÏãúÍ≥Ñ. pratik 3Ïõî 5, 2022. 0. Ï†Ñ ÏÑ∏Í≥Ñ ÏàòÏòÅ ÏãúÍ≥Ñ ÏãúÏû• ÏòàÏ∏°Ïóê ÎåÄÌïú ÏµúÏã†¬†...",['sport tech']
Alberto Fern√°ndez se reuni√≥ con CEO de Eramet por ...,"7 days ago ‚Äî Leandro Alvarez ¬∑ Related Posts ¬∑ Oliver, la startup de sportech que da servicios de IA a los clubes/ Titulares ¬∑ Europa reconsidera su futuro¬†...",['sport tech']
TOTALSPORTEK - Best SoccerStreams,Best alternative to soccerstreams to feed of your live footy hunger. Fastest loading times and Top streamers links are ranked according to quality.,['sport tech']
Mercado SPORTECH Textiles 2022 Cuota ... - MotorEsfera.com,"5 days ago ‚Äî Mercado SPORTECH Textiles 2022 Cuota de mercado, principales fabricantes, tendencias, crecimiento, tama√±o del mercado y pron√≥stico para 2026. By¬†...",['sport tech']
TOTALSPORTEK | Total Sportek Live Streaming - Live Sport ...,"TotalSportek Live Streaming - Watch Live Football, Rugby, F1, Cricket, Racing, Boxing, Tennis, NFL and more live streams with Totalsportek.",['sport tech']
Í∏ÄÎ°úÎ≤å ÏàòÏòÅ ÏãúÍ≥Ñ ÏãúÏû• Ï°∞ÏÇ¨ Î≥¥Í≥†ÏÑú 2022ÎÖÑÎ∂ÄÌÑ∞ 2029ÎÖÑÍπåÏßÄ ...,"Í∏ÄÎ°úÎ≤å ÏàòÏòÅ ÏãúÍ≥Ñ ÏãúÏû• Ï°∞ÏÇ¨ Î≥¥Í≥†ÏÑú 2022ÎÖÑÎ∂ÄÌÑ∞ 2029ÎÖÑÍπåÏßÄ PASNEW, Sportech, iRapid. ÏàòÏòÅ ÏãúÍ≥Ñ. pratik 3Ïõî 5, 2022. 0. Ï†Ñ ÏÑ∏Í≥Ñ ÏàòÏòÅ ÏãúÍ≥Ñ ÏãúÏû• ÏòàÏ∏°Ïóê ÎåÄÌïú ÏµúÏã†¬†...",['sport tech']
Alberto Fern√°ndez se reuni√≥ con CEO de Eramet por ...,"7 days ago ‚Äî Leandro Alvarez ¬∑ Related Posts ¬∑ Oliver, la startup de sportech que da servicios de IA a los clubes/ Titulares ¬∑ Europa reconsidera su futuro¬†...",['sport tech']
TOTALSPORTEK - Best SoccerStreams,Best alternative to soccerstreams to feed of your live footy hunger. Fastest loading times and Top streamers links are ranked according to quality.,['sport tech']
Mercado SPORTECH Textiles 2022 Cuota ... - MotorEsfera.com,"5 days ago ‚Äî Mercado SPORTECH Textiles 2022 Cuota de mercado, principales fabricantes, tendencias, crecimiento, tama√±o del mercado y pron√≥stico para 2026. By¬†...",['sport tech']
TOTALSPORTEK | Total Sportek Live Streaming - Live Sport ...,"TotalSportek Live Streaming - Watch Live Football, Rugby, F1, Cricket, Racing, Boxing, Tennis, NFL and more live streams with Totalsportek.",['sport tech']
Pneu Metzeler 160/60Zr17 Sportec M9 RR Traseiro (Tl) 69W,"Encontre Pneu Metzeler 160/60Zr17 Sportec M9 RR Traseiro (Tl) 69W no Carrefour! Ofertas imperd√≠veis, excelente condi√ß√µes de pagamento e muito mais.",['sport tech']
Tu≈æka a pap√≠r. Dƒõti ze ≈†afa≈ôky si dopisuj√≠ s kamar√°dy z Finska,"3 days ago ‚Äî D√°le napsali kamar√°d≈Øm o v≈°em, co maj√≠ a nemaj√≠ r√°di ‚Äì o sportech, zv√≠≈ô√°tk√°ch, barviƒçk√°ch, sv√Ωch kon√≠ƒçc√≠ch a spoustƒõ dal≈°√≠ch t√©mat.",['sport tech']
Sports Betting Market Size to Grow by USD 106.25 Billion,"19 hours ago ‚Äî ... GVC Holdings Plc, Kindred Group Plc, Sportech Plc, The Stars Group Inc., Webis Holdings Plc, and William Hill Plc among others.",['sport tech']
ASAD Biella in campo allo Sportec Center di Gaglianico per la ...,"1 day ago ‚Äî ASAD Biella in campo allo Sportec Center di Gaglianico per la prima edizione di ‚ÄúSpecial Football‚Äù, torneo nazionale di ‚Äúcalcio unificato‚Äù.",['sport tech']
TotalSportek ‚Äì Total Sportek Live Reddit Soccer Streams,"TotalSportek Live Reddit Soccer Streams that brings Football and other sports - UFC, Boxing, Basketball, Soccer, NFL, Tennis and Cricket match and games.",['sport tech']
