titles,summaries,terms
Lexus | Experience Amazing,"Welcome to Lexus; official site. Explore the line of Lexus luxury sedans, SUVs, hybrids, performance cars and accessories, or find a Lexus dealer near you.",['sport']
Athens World Company Sports Games 2021: _Home,... Company Sport and Health and the Hellenic Organization for Company Sport and Health invite you to join the 3rd World Company Sport Games 2021 in Greece!,['sport']
Sport Company - Home | Facebook,"SPORT COMPANY, VOC√ä COM ATITUDE ! Santa Cruz do Capibaribe, PE, Brazil.",['sport']
Bravo Sports Corp,"Nov 8, 2021 ‚Äî We don't just sell sports equipment. We live and breathe the Southern California lifestyle, that helps bring our brands to life.",['sport']
The World's Top 10 Most Innovative Companies In Sports,"Feb 14, 2014 ‚Äî Whether they're redefining ticket sales or building a stadium worthy of Silicon Valley, when it comes to the business of athletic entertainment,¬†...",['sport']
Data science is a team sport - Fortune,"2 days ago ‚Äî Diverse teams are needed to build effective algorithms, says the top data executive at a data analytics company Qlik.",['sport']
Cycling Sports Group,"As a parent company of such legendary brands as Schwinn, Mongoose and KidTrax, Pacific Cycle delivers some of the biggest names in outdoor recreation.",['sport']
EXTREME ‚Äì The Iconic Action and Adventure Sport lifestyle ...,"Every month EXTREME engages millions of fans through action sports, athletes, partnerships, events, music, media, licensing and marketing services.",['sport']
The Pickle Juice Company,"Pickle Juice¬Æ is designed and formulated to Stop Muscle Cramps and stay hydrated. USDA Organic, 10x the electrolytes of common sports drinks, sugar-free,¬†...",['sport']
BC Surf & Sport |,"B.C Surf & Sport began with one small store in Ft. Lauderdale, Florida over thirty-five years ago and is still owned and ... Company Logo BC Surf & Sport.",['sport']
10 Biggest Sports Brands in the World,1. Nike ¬∑ 2. Adidas ¬∑ 3. Sky Sports ¬∑ 4. ESPN ¬∑ 5. Under Armour ¬∑ 6. Puma ‚Ç¨4.64 billion ¬∑ 7. Asics ¬∑ 8. UFC.,['sport']
"HOK | A Global Design, Architecture, Engineering and ...","HOK is a global design, architecture, engineering and planning firm. Our people collaborate across a network of 24 offices on three continents.",['sport']
WSI Sports - America's Best Performance/Cold Weather ...,"WSI has been dedicated to creating innovative, superior-quality, warm/cold weather performance apparel and athleisure wear made in USA since 1990.",['sport']
Overview - Sports Fitness Insurance Corporation,"Dec 29, 2020 ‚Äî No-hassle Liability and Property Insurance from experts with over 30 years experience protecting health and fitness industry professionals.",['sport']
"hummel¬Æ | Browse clothing, shoes and accessories","Shop sportswear, athleisure wear and shoes for men, women and kids at hummel.net ‚Äì Discover the brand new collections right here.",['sport']
Fine/ Sport - Wool and Company Fine Yarn,"Free U.S. Shipping and Ball Winding on All Orders, No Minimum! Fine or Sport weight yarn has a large range of uses. It is popular for baby garments (due to¬†...",['sport']
City Sports Online Sporting Goods Shop,Since 1983 City Sports has served a dedicated customer base with a fine ... AUTHENTIC brand products | EASY Returns & exchanges ... CB SPORTS JACKETS.,['sport']
Sports Business Journal,SMAC Entertainment CEO and co-founder Constance Schwartz-Morini. Schwartz-Morini spent a decade at the NFL before joining broadcaster and NFL legend Michael¬†...,['sport']
FanDuel | Daily Fantasy Sports and Online U.S. Sportsbook,"... prizes & legal wagering on sports betting markets for all major sports. ... Easy to sign up and place bets; Available in NJ, NY, PA, WV, IN, CO, IL, TN,¬†...",['sport']
Acura.com: Premium Sedans and SUVs,Discover Acura's exceptional line of cars and SUVs built for exhilarating performance and unsurpassed comfort. Enjoy top safety ratings across the entire¬†...,['sport']
Official BUGATTI Automotive Website,Bugatti's official website: the brand that combines an artistic approach with superior technical innovations in the world of super sports cars.,['sport']
POC Sports: POC | Cycling Helmets and Apparel | Snow ...,POC is a Swedish company with a strong mission to do the best we can to possibly save lives and to reduce the consequences of accidents for gravity sports¬†...,['sport']
BC Surf & Sport |,"B.C Surf & Sport began with one small store in Ft. Lauderdale, Florida over thirty-five years ago and is still owned and ... Company Logo BC Surf & Sport.",['sport']
"HOK | A Global Design, Architecture, Engineering and ...","HOK is a global design, architecture, engineering and planning firm. Our people collaborate across a network of 24 offices on three continents.",['sport']
WSI Sports - America's Best Performance/Cold Weather ...,"WSI has been dedicated to creating innovative, superior-quality, warm/cold weather performance apparel and athleisure wear made in USA since 1990.",['sport']
Overview - Sports Fitness Insurance Corporation,"Dec 29, 2020 ‚Äî No-hassle Liability and Property Insurance from experts with over 30 years experience protecting health and fitness industry professionals.",['sport']
About Our Beers | Boulevard Brewing Company,"Our beers begin with specially selected, carefully inspected ingredients. Our brew process is designed to maximize flavor, from the brewhouse to the bottle.",['sport']
City Sports Online Sporting Goods Shop,Since 1983 City Sports has served a dedicated customer base with a fine ... AUTHENTIC brand products | EASY Returns & exchanges ... CB SPORTS JACKETS.,['sport']
Sports Business Journal,SMAC Entertainment CEO and co-founder Constance Schwartz-Morini. Schwartz-Morini spent a decade at the NFL before joining broadcaster and NFL legend Michael¬†...,['sport']
Darien Sport Shop | Luxury Sportswear & Accessories ...,"Darien Sport Shop offers the finest men's apparel, women's apparel, and kid's apparel in Fairfield County. Shop Peter Millar, Kinross Cashmere, and more!",['sport']
Sport companies | Craft.co,"Sport companies include Nike, Sirius XM, Foot Locker, DICK'S Sporting Goods, Academy Sports + Outdoors and 1391 other companies.",['sport']
De Soto Sport - Triathlon & Endurance Sports Apparel ...,"De Soto Sport is one of the leading manufacturers of triathlon and endurance sports apparel & wetsuits. We have leveraged first-hand triathlon, marathon,¬†...",['sport']
Eastbay: Gear Up Your Game - Athletic Shoes & Clothing,"Play daily for your chance to win Foot Locker, Inc. gift cards + bigger prizes like $5,000, AJ4 'Lightning', Bose SoundLink Revolve+ Speaker & more.",['sport']
Riddell | Boldly Championing the Future of Football,"We use cookies to ensure that we give you the best experience on our website. If you continue, you agree with our policy statement .",['sport']
"Sports brand logos, Clothing logo, Company logos and names","sports-apparel-brands Sports Brand Logos, Sports Brands, Sports Logo, Clothing. sportsnetworker. Sports Networker. 150 followers.",['sport']
Dodge Official Site ‚Äì Muscle Cars & Sports Cars,"BRING THE DEALER TO YOUR DRIVEWAY ... A profile view of the Dodge Brand lineup, from left to right: a gray.",['sport']
"Ducati: Moto, MotoGP & Superbike",Copyright ¬© 2022 Ducati Motor Holding S.p.A ‚Äì A Sole Shareholder Company - A Company subject to the Management and Coordination activities of AUDI AG.,['sport']
The Business of Sports - Front Office Sports - FOS,Barstool Sports' chief revenue officer Deirdre Lester has been named chief executive officer of new lifestyle company Outsider.,['sport']
"Honda Powersports - Motorcycles, ATVs, Scooters, SxS","2022 American Honda Motor Co., Inc.‚Ä¢ Powersports Division. Twitter ¬∑ Instagram ¬∑ YouTube ¬∑ Facebook. We use cookies to improve your experience on this site¬†...",['sport']
"The official site of the NBA for the latest NBA Scores, Stats ...","The official site of the National Basketball Association. Follow the action on NBA scores, schedules, stats, news, Team and Player news.",['sport']
On | Swiss Performance Running Shoes & Clothing,They can be used by these companies to create a profile of your interests and to show you relevant advertisements on other websites.,['sport']
WSC SPORTS,"Our AI cloud platform enables sports media right owners to generate ... ... WSC Sports, a B2B sports video company, has raised $100 million in a series D¬†...",['sport']
Outdoor Trampolines and Fitness Trampolines from JumpSport,"... kids while still letting them have a great time is what JumpSport and AlleyOOP Sports are all about. ... Product Safety Inventor & CEO, JumpSport Inc.",['sport']
SPORTFIVE,"So, if you're a brand, rights-holder or media platform looking to thrive in the world of sport, here are some of the ways we can help you. for. brands. Sports¬†...",['sport']
Company - Verge Sport,Verge Sport is an American brand with European manufacturing and an international presence. The inspiration behind the company came from the clothing needs¬†...,['sport']
Scott Sports,Select your country to view the products available in your location. Please note that online shopping options and product availability may differ depending¬†...,['sport']
Company Casuals: Homepage,Brands. Port Authority ¬∑ Port & Company ¬∑ Sport-Tek ¬∑ Mercer+Mettle ¬∑ Red House ¬∑ District ¬∑ Volunteer Knitwear ¬∑ CornerStone ¬∑ Nike ¬∑ TravisMathew ¬∑ OGIO¬†...,['sport']
Official Sports International,"Since 1984, Official Sports,has been dedicated to serving the apparel and equipments needs of only soccer referees. As part of this dedication,¬†...",['sport']
Infront Sports & Media,... in identified strategic pillars ‚Äì laying the foundation to transform sport on a global scale. ... EXCITING PERSONAL & CORPORATE FITNESS EVENTS.,['sport']
Scott Sports,Select your country to view the products available in your location. Please note that online shopping options and product availability may differ depending¬†...,['sport']
Sportlogiq - Home,SPORT'S SHARPEST EDGE. Sportlogiq helps teams gain an edge and media surface engaging stories with advanced AI technology¬†...,['sport']
Eastbay: Gear Up Your Game - Athletic Shoes & Clothing,"Play daily for your chance to win Foot Locker, Inc. gift cards + bigger prizes like $5,000, AJ4 'Lightning', Bose SoundLink Revolve+ Speaker & more.",['sport']
Sport Company - Fashion4All,"LOCALIZA√á√ÉO MODA CENTER SANTA CRUZ. Sport Company - Loja 1. Setor Verde, Bloco 5, Lojas 9 e 10. Sport Company - Loja 3. Setor Branco, Bloco 2, Lojas 13 e 14¬†...",['sport']
"Mazda USA Official Site | Cars, SUVs & Crossovers | Mazda ...",... of enveloping comfort that makes every journey more inspiring. Explore. Feel Alive¬Æ. Previous. US News and World Report ‚Äì Mazda 2021 Best Car Brand¬†...,['sport']
Aim Sports Inc,"Aim Sports Inc is a firearm accessories manufacturer and distributor. We provide custom accesories for AR, Shotguns and Pistols.",['sport']
Restaurant & Sports Bar | Walk-On's Sports Bistreaux,"Grab a bite with your family at Walk On's Sports Bar and Restaurant. Check our menu of burgers, sides, salads, ... Brandon Landry. Founder, Co-Owner and CEO.",['sport']
InStat,"InStat has signed a MoU with PR Solution, a Kolkata-based production firm, in terms of sports production in the South Asian region. InStat ScoutFor media¬†...",['sport']
"Tahoe Sports | #1 Lake Tahoe Boat & Jet Ski Rentals, Tours ...","From powerboat rentals, to jet ski tours & water toys, Tahoe Sports has it ... Tahoe Sports is the largest Lake Tahoe rental company on the South Shore.",['sport']
"History of Sport Supply Group, Inc. - Reference For Business","The largest direct mail distributor of sports-related equipment in the United States, Sport Supply Group, Inc. manufactures and markets approximately 8,000¬†...",['sport']
Sportlogiq - Home,SPORT'S SHARPEST EDGE. Sportlogiq helps teams gain an edge and media surface engaging stories with advanced AI technology¬†...,['sport']
Home - BBC Sport,"Breaking news & live sports coverage including results, video, audio and analysis on Football, F1, Cricket, Rugby Union, Rugby League, Golf, Tennis and all¬†...",['sport']
BPI Sports¬Æ Official Site - Nutritional Supplements,"BPI Sports is a sports nutrition company offering affordable, high-quality supplements, free workouts, diets, and fitness advice.",['sport']
Sport Company - Fashion4All,"LOCALIZA√á√ÉO MODA CENTER SANTA CRUZ. Sport Company - Loja 1. Setor Verde, Bloco 5, Lojas 9 e 10. Sport Company - Loja 3. Setor Branco, Bloco 2, Lojas 13 e 14¬†...",['sport']
"Mazda USA Official Site | Cars, SUVs & Crossovers | Mazda ...",... of enveloping comfort that makes every journey more inspiring. Explore. Feel Alive¬Æ. Previous. US News and World Report ‚Äì Mazda 2021 Best Car Brand¬†...,['sport']
Aim Sports Inc,"Aim Sports Inc is a firearm accessories manufacturer and distributor. We provide custom accesories for AR, Shotguns and Pistols.",['sport']
Wallaroo Hat Company Women's Victoria Sport Hat - Sporty,Buy Wallaroo Hat Company Women's Victoria Sport Hat - Sporty and Compact - Black: Shop top fashion brands Sun Hats at Amazon.com ‚úì FREE DELIVERY and¬†...,['sport']
InStat,"InStat has signed a MoU with PR Solution, a Kolkata-based production firm, in terms of sports production in the South Asian region. InStat ScoutFor media¬†...",['sport']
"Tahoe Sports | #1 Lake Tahoe Boat & Jet Ski Rentals, Tours ...","From powerboat rentals, to jet ski tours & water toys, Tahoe Sports has it ... Tahoe Sports is the largest Lake Tahoe rental company on the South Shore.",['sport']
Company Casuals: Homepage,Brands. Port Authority ¬∑ Port & Company ¬∑ Sport-Tek ¬∑ Mercer+Mettle ¬∑ Red House ¬∑ District ¬∑ Volunteer Knitwear ¬∑ CornerStone ¬∑ Nike ¬∑ TravisMathew ¬∑ OGIO¬†...,['sport']
Mondo Worldwide ‚Äì Sport & Rubber Gym Flooring Systems,"Mondo is the premiere sport, gymnasium, Olympic & artificial turf flooring company allowing athletes to break world records and overcome their limits.",['sport']
OutKick - Fearless Sports Media Company Founded by Clay ...,"OutKick authentically covers the latest sports, media, and political news everyday with articles, videos, podcasts, community and more. DBAP.",['sport']
Art of Sport Company Profile: Valuation & Investors | PitchBook,"Producer of body care products intended to cater to the personal care requirements of athletes. The company's products include deodorants, antiperspirants, hair¬†...",['sport']
"History of Sport Supply Group, Inc. - Reference For Business","The largest direct mail distributor of sports-related equipment in the United States, Sport Supply Group, Inc. manufactures and markets approximately 8,000¬†...",['sport']
COROS | Performance Sports Technology,"Innovation for runners, adventurers and athletes of all sports.",['sport']
"Equinox Luxury Fitness Club - It's Not Fitness, It's Life","Equinox is a temple of well-being, featuring world-class personal trainers, group fitness classes, and spas. Voted Best Gym in America by Fitness Magazine.",['sport']
New Balance: Athletic Footwear and Fitness Apparel,Tackle your workouts with confidence in performance running shoes and stylish clothes from New Balance. Our athletic footwear goes the distance with you.,['sport']
The Look Company: Visual Engagement Solutions for Retail ...,The Look Company Offers a Range of Visual Engagement Solutions to Transform Retail & Sport Environments into Engaging and Memorable Brand Experiences.,['sport']
Alpina Sports,Some people are born to want it all. Style and function. Performance and grace. Good looks and an amazing brain. Quality and user-friendliness. These are p.,['sport']
High Sierra | Official Site| Backpacks & Luggage,"Shop the official High Sierra online store and get top quality backpacks, luggage, and bags. We warranty bags to let you focus on the adventure,¬†...",['sport']
"News, sport and opinion from the Guardian's US edition | The ...","Latest US news, world news, sports, business, opinion, analysis and reviews ... Analysis Oil and gas companies are looking at a bonanza from the Ukraine war.",['sport']
Trek Bikes - The world's best bikes and cycling gear | Trek Bikes,Electra brand ¬∑ Electra brand ¬∑ Ride bikes. Have fun. Feel good. ¬∑ Supercaliber's finest year ¬∑ Session's biggest season ¬∑ No time to waste ¬∑ Brave the unpaved.,['sport']
Dunham's Sports - OFFICIAL SITE,Big Names...Low Prices. Delivering Value since 1937. Your Hometown Sporting Goods Store.,['sport']
Michigan Sport Fishing Company,Michigan Sport Fishing Company ... If it's big fish and a unique chartering experience you're looking for you're in the right place! We offer Lake Michigan and¬†...,['sport']
Audi Sport,"Adding to this, the brand is also preparing for its return to hybrid sportscar racing and the Le Mans 24 Hours in 2023. The road-going models from the brand¬†...",['sport']
"Headphones, Speakers, Wearables | Bose | Feel More Do More","Shop our wide selection of earbuds, headphones, speakers, sound bars & more available in a variety of styles such as wireless and bluetooth enabled.",['sport']
VAUDE: Sustainable Outdoor Clothing & Gear,Sustainable innovative outdoor outfitter for all mountain and bike sports. Eco-friendly products ‚úì Partner of FairWear Foundation ‚úì Developed with at‚Ä¶,['sport']
Cramer Sports Medicine: Home - Cramer,Cramer Sports Medicine Cramer Sports Medicine. COMPANY. Company ¬∑ Brands ¬∑ History ¬∑ PRODUCTS; RESOURCES. First Aider ¬∑ Featured Product Booklet¬†...,['sport']
Strider Bikes | Best-Selling Balance Bikes for Kids | Official ...,"From babies to big kids, we've got just the right bike for instant success. A child balances on their pink Strider 12"" Sport along with their toy dinosaur¬†...",['sport']
"TeamSnap: Youth Sports Team, Club & League Management ...",The #1 sports team management app makes communication and organization a breeze. Clubs and leagues love us too. Try it now.,['sport']
Garretson's Sport Center,"Largest Family-Owned Sporting Goods Store ¬∑ Featured Brand: adidas. adidas-logo ¬∑ Of course we sell Yeti. Come in, let us tell you why! ¬∑ hunting, war, army and¬†...",['sport']
Freemans Sporting Club: Handmade menswear designed by ...,Making menswear in America long before it was a marketing tool. High-quality suits canvassed and made by hand in the USA. Check out our website and learn¬†...,['sport']
Alpina Sports,Some people are born to want it all. Style and function. Performance and grace. Good looks and an amazing brain. Quality and user-friendliness. These are p.,['sport']
Trek Bikes - The world's best bikes and cycling gear | Trek Bikes,Electra brand ¬∑ Electra brand ¬∑ Ride bikes. Have fun. Feel good. ¬∑ Supercaliber's finest year ¬∑ Session's biggest season ¬∑ No time to waste ¬∑ Brave the unpaved.,['sport']
NFL.com | Official Site of the National Football League,"The official source for NFL News, NFL video highlights, Fantasy Football, game-day coverage, NFL schedules, stats, scores & more.",['sport']
"ATVs, Motorcycles, Generators, Side-by-Sides, Snowmobiles ...",Corporate Links. Yamaha Motor USA Home ¬∑ Become a Dealer ¬∑ Privacy Policy ¬∑ Terms & Conditions ¬∑ Do Not Sell My Personal Information ¬∑ CPSC Alerts¬†...,['sport']
Teamworks - The Elite Athletics Operating System,The next generation of digital software for athletic organizations and the players that drive them. ... NIL & Brand Building.,['sport']
Michigan Sport Fishing Company,Michigan Sport Fishing Company ... If it's big fish and a unique chartering experience you're looking for you're in the right place! We offer Lake Michigan and¬†...,['sport']
Audi Sport,"Adding to this, the brand is also preparing for its return to hybrid sportscar racing and the Le Mans 24 Hours in 2023. The road-going models from the brand¬†...",['sport']
"Sun & Ski Sports: Ski & Snowboard, Bikes, Clothing & Footwear",Company; About Us ¬∑ Career Opportunities ¬∑ Terms of Use ¬∑ Privacy Policy. Main Menu. Snow; Ski; Snowboard; Clothing & Boots; Snow Accessories.,['sport']
PUMA.com | Forever Faster.,"Run The Streets. Do You. Research and shop all the latest gear from the world of Fashion, Sport, and everywhere in between.",['sport']
ICON Aircraft | Maker of the ICON A5 Amphibious Airplane,"ICON Aircraft is the manufacturer of the amphibious light-sport airplane the ICON A5 (S-LSA). Learn more about the design of the ICON A5, how to buy our¬†...",['sport']
Patagonia Outdoor Clothing & Gear,"Patagonia is a designer of outdoor clothing and gear for the silent sports: climbing, surfing, ... 2022 Patagonia, Inc. All Rights Reserved.",['sport']
"Made for riders, by riders. | Specialized.com","Do Not Sell My Personal Information (California) ¬∑ California Transparency Act. ¬© 2022 Specialized Bicycle Components, Inc. All Rights Reserved. Facebook¬†...",['sport']
"Ticketmaster: Buy Verified Tickets for Concerts, Sports ...","Buy and sell tickets online for concerts, sports, theater, family and other events near you from Ticketmaster.",['sport']
Aston Martin | Iconic Luxury British Sports Cars (USA),Brand Stories ‚Äî. Discover the values of Aston Martin and how they are captured in everything we do. ; Racing ‚Äî. Racing is the lifeblood of Aston Martin and our¬†...,['sport']
The World's Top 10 Most Innovative Companies In Sports,"Feb 14, 2014 ‚Äî Whether they're redefining ticket sales or building a stadium worthy of Silicon Valley, when it comes to the business of athletic entertainment,¬†...",['sport']
Garmin International | Home,"GPS smartwatches in two sizes, featuring built-in sports apps, contactless payments, music and all-day health monitoring.",['sport']
VAUDE: Sustainable Outdoor Clothing & Gear,Sustainable innovative outdoor outfitter for all mountain and bike sports. Eco-friendly products ‚úì Partner of FairWear Foundation ‚úì Developed with at‚Ä¶,['sport']
Esports Entertainment Group | Esports Wagering Platform,"Sports Betting ¬∑ NJ approves company to take bets on competitive video games ... February 27, 2022) - Esports Entertainment Group, Inc. (NASDAQ: GMBL)¬†...",['sport']
Garmin International | Home,"GPS smartwatches in two sizes, featuring built-in sports apps, contactless payments, music and all-day health monitoring.",['sport']
UFC.com: The Official Home of Ultimate Fighting Championship,"The official home of Ultimate Fighting Championship. Enjoy the latest breaking news, fights, behidn-the-scenes access and more.",['sport']
Sport Event Management Company | PRO EM,"Sport Event Management Company. PRO EM National Events Services has been providing sports event management, tents, custom structures, equipment,¬†...",['sport']
Esports Entertainment Group | Esports Wagering Platform,"Sports Betting ¬∑ NJ approves company to take bets on competitive video games ... February 27, 2022) - Esports Entertainment Group, Inc. (NASDAQ: GMBL)¬†...",['sport']
Company,"We create, present and develop world-famous brands. We long to: Provide the Russian professional athletes and fans with sport outfit of the highest¬†...",['sport']
"Oakley¬Æ Official Store: Sunglasses, Goggles & Apparel ...","Boardshorts. -. SPORTS ... Copyright ¬©2022 Oakley, Inc. All Rights Reserved. Other sites of the Group. Close. Select your country. Americas. Brasil (Brazil).",['sport']
"Finish Line: Shoes, Sneakers, Athletic Clothing & Gear","Shop Finish Line for basketball sneakers, running shoes, casual shoes & athletic gear from top brands like Nike, Jordan, adidas, Under Armour & more.",['sport']
SPORTT ‚Äì The Sports Company of Trinidad and Tobago Limited,"T&T Exercises: SPORTT & TTCSI roll out results of National Sport Participation Survey. February 16, 2022, Balmain Couva: The Sports Company of Trinidad and¬†...",['sport']
61 Reviews of M Sport Motor Car Company - DealerRater,"61 Reviews of M Sport Motor Car Company - Used Car Dealer, Service Center Car Dealer Reviews & Helpful Consumer Information about this Used Car Dealer,¬†...",['sport']
"Shop Athleta for Women's Yoga Clothing, Technical Athletic ...",Athleta designs clothing that integrates performance and technical features for active women and girls. From running and yoga to swimming and hiking or¬†...,['sport']
Data science is a team sport - Fortune,"2 days ago ‚Äî Diverse teams are needed to build effective algorithms, says the top data executive at a data analytics company Qlik.",['sport']
"GoSun | Solar Ovens, Solar Cooling, Solar Charger, Solar ...",Sport. Fastest Solar Oven ‚Ä¢ 2-3 Meals. 177 reviews $279 ... GoSun is growing and needs capital to become the World's Best Clean Tech Brand.,['sport']
Buffalo Wild Wings | Wings. Beer. Sports,Enjoy all Buffalo Wild Wings to you has to offer when you order delivery or pick it up yourself or stop by a location near you. Buffalo Wild Wings to you is¬†...,['sport']
Enell Sports Bras,ENELL makes the best fitting sports bra for well-endowed women. With sizes that fit between a 32C and 52GG and both medium and high impact support options.,['sport']
"Andrews'sport Company - 4308 Firestone Rd, Metairie, LA - Yelp","Andrews'sport Company in Metairie, reviews by real people. Yelp is a fun and easy way to find, recommend and talk about what's great and not so great in¬†...",['sport']
