titles,summaries,terms
Svƒõtov√© plav√°n√≠ trv√° na sv√©m: Rusy a Bƒõlorusy ze sv√Ωch akc√≠ ...,"1 day ago ‚Äî ‚ÄûP≈ôi odsouzen√≠ rusk√© invaze na Ukrajinu a diskus√≠ch o dopadech n√°sledn√© v√°lky na sportovce v plaveck√Ωch sportech a z√°vody, rada FINA z≈Øst√°v√°¬†...",['sport tech']
–†—ã–Ω–æ–∫ Sportech Textiles. 2022 –≥. –ü–æ—Å–ª–µ–¥–Ω–∏–µ –≤–æ–∑–º–æ–∂–Ω–æ—Å—Ç–∏ ...,"1 day ago ‚Äî –û—Ç—á–µ—Ç Global Sportech Textiles. Market Research 2021 –ø—Ä–µ–¥—Å—Ç–∞–≤–ª—è–µ—Ç –Ω–∞–∏–±–æ–ª–µ–µ —Ü–µ–Ω–Ω—É—é –∏–Ω—Ñ–æ—Ä–º–∞—Ü–∏—é –æ –≥–ª–æ–±–∞–ª—å–Ω—ã—Ö —Ä—ã–Ω–æ—á–Ω—ã—Ö –≤–æ–∑–º–æ–∂–Ω–æ—Å—Ç—è—Ö, –ø—Ä–æ–±–ª–µ–º–∞—Ö,¬†...",['sport tech']
"Tuning Audi S3, 300 ch pour Sportec - Automobile Sportive","May 26, 2007 ‚Äî Avec la nouvelle Audi S3, Sportec a trouv√© une base d√©j√† tr√®s performante pour nous fabriquer une super sportive dont on.",['sport tech']
SPORTEC M9 RR„Äê120/70ZR17M/C (58W) TL„Äë Ëº™ËÉé - Webike,"Mar 1, 2022 ‚Äî METZELER SPORTEC M9 RR„Äê120/70ZR17M/C (58W) TL„Äë Ëº™ËÉé(3616900)ÔºåÊàëÂÄëÊèê‰æõÂ§öÁ®Æ‰ªòÊ¨æÊñπÂºèÔºå‰∏¶ÊúâÊ≠£ÂìÅËàáÈÄÄË≤®‰øùË≠âÔºåËÆìÊÇ®Ë≥ºÁâ©ÁÑ°Ë≤†ÊìîÔºÅ",['sport tech']
Trust Company of Chicago V. Pennsylvania Railroad Company,"1949... homicide ( specify ) . kus Dura deca ( 6 ) Where did injury plece , in publie plecet . wa mo 12 ( ex Guesthood when Ali cordless Ra TE Sportech TI 19.",['sport tech']
Samuel Manzano-IGOID Sportec-Protocolo Active Health ...,9 hours ago ‚Äî El pasado lunes se inici√≥ en los servicios deportivos el desarrollo del Protocolo Active Health Sportec por parte del grupo IGOID.,['sport tech']
"Rozhledy - Volume 15, Part 2 - Page 787 - Google Books Result","1905 ¬∑ ‚ÄéCzech Republic... v turistice , alpinismu a venkovn√≠ch sportech . Tento houfn√Ω n√°vrat k p≈ô√≠rodƒõ m√° tedy v podstatƒõ p≈ô√≠ƒçiny utilitaristn√≠ ( zdravotn√≠ a j . )¬†...",['sport tech']
DICK'S Sporting Goods - Official Site - Every Season Starts at ...,"Visit DICK'S Sporting Goods and Shop a Wide Selection of Sports Gear, Equipment, Apparel and Footwear! Get the Top Brands at Competitive Prices.",['sport']
Top 10 Sports Brands & Companies across the World,Top 10 Sports Brands & Companies across the World ¬∑ 1) Adidas ‚Äì Flaunt Uniqueness with Adidas Sports equipments! ¬∑ 2) Reebok ‚Äì Look Impeccably Stylish! ¬∑ 3) Nike ‚Äì¬†...,['sport']
"The Athletic - Sports news, stories, scores, schedules ...","Unrivaled sports coverage across every team you care about and every league you follow. Get breaking news, powerful stories and smart analysis from the best¬†...",['sport']
Sports Apparel and Equipment - Team Uniforms | BSN SPORTS,"Shop BSN SPORTS for a large selection of sports apparel and footwear, custom and stock Nike team uniforms and sports equipment for your next winning season.",['sport']
Stack Sports: Home,"6 days ago ‚Äî Powering Your Sports Experience ... The Stack Sports ecosystem powers the athletes, teams, ... Boost your brand and your business.",['sport']
ESPN: Serving sports fans. Anytime. Anywhere.,"Visit ESPN to get up-to-the-minute sports news coverage, scores, highlights and commentary for NFL, MLB, NBA, College Football, NCAA Basketball and more.",['sport']
Academy Sports + Outdoors | Quality Sporting Goods | Top ...,"Shop Academy Sports + Outdoors for sporting goods, hunting, fishing and camping equipment. Find recreation and leisure products, footwear, apparel, grills,¬†...",['sport']
Champs Sports: We Know Game,"With these cute and comfy looks from cozi, you'll look great and feel even better. Cozy up in all the latest drops from our new women's brand. SHOP NEW COZI.",['sport']
"FOX Sports News, Scores, Schedules, Odds, Shows, Streams ...","Watch FOX Sports and view live scores, odds, team news, player news, streams, videos, stats, standings & schedules covering NFL, MLB, NASCAR, WWE, NBA, NHL,¬†...",['sport']
"Performance Athletic Apparel, T-Shirts, Fleeces & Shorts ...","Badger Sport is a leading provider of superior-quality team uniforms and performance athletic wear, including performance t-shirts, fleeces, shorts,¬†...",['sport']
SportsEngine: The Home of Youth Sports,"SportsEngine by NBC Sports is the home of youth sports. Find the perfect sport league, camp, clinic or tournament near you. From baseball, soccer and¬†...",['sport']
Wholesale Sports Apparel & Bulk Team Clothing | Augusta ...,"... Source for Wholesale Performance & Athletic Apparel and Uniforms. ... coaches, athletes, fans and corporate needs, our family of brands offers a¬†...",['sport']
Sports Illustrated,"Sports Illustrated, SI.com provides sports news, expert analysis, highlights, stats and scores for the NFL, NBA, MLB, NHL, college football, soccer,¬†...",['sport']
Amer Sports,"Amer Sports. is a sporting goods company with internationally recognized brands including Salomon, Arc'teryx, Peak Performance, Atomic, Suunto and Wilson.",['sport']
"Youth Sports Programs for Kids, Leagues, Camps & Clinics |","i9 Sports offers fun youth sports leagues, camps & clinics for kids ages 3 & up in communities across the country. Find a program in your area today!",['sport']
"Decathlon | Best Gear, Clothing and Footwear For All Sports ...",World leader in sports equipment now in the USA. Shop Decathlon for 10000+ products across 80+ sports. Free shipping over $35. Free pickup. Free returns.,['sport']
Wilson Sporting Goods | Official Website,They may be used by those companies to build a profile of your interests and show you relevant adverts on other sites. They do not store directly personal¬†...,['sport']
The World Federation for Company Sport: Home,The World Federation for Company Sport (WFCS) is a voluntary non-profit organization gathering national company sport or other federations taking care about¬†...,['sport']
adidas Official Website | adidas US,"adidas is about more than sportswear and workout clothes. We partner with the best in the industry to co-create. This way we offer our fans the sporting goods,¬†...",['sport']
HEAD: Sports,"About HEAD sports ... to allow them to be the best they can be in racquet sports, winter sports, or swimming. ... HEAD Company logo. ¬© 2022 HEAD.",['sport']
Genius Sports - Genius Sports,"Powering the world of sport. In sport, fine margins are the difference between winning and losing. We build innovative technology that unlocks the true¬†...",['sport']
"Eastern Mountain Sports | Your go-to for gear, guidance, and ...","The most trusted source for outdoor apparel, gear & guidance for the outdoor adventurers.",['sport']
REI: A Life Outdoors is a Life Well Lived | REI Co-op,"Top-brand gear, clothing‚Äîand outdoor adventures! Plus rentals, classes, events, expert advice and more. Visit REI Co-op online and in-store.",['sport']
List of sporting goods manufacturers - Wikipedia,ManufacturerCountryFoundedFounder(s)Total ass...AdidasGermany18 August 1949Adolf Dassler‚Ç¨5.489 bil...AdmiralUnited Kingdom1914Cristopher Cook & Harold HurstAmazin SportsUnited States2021Jason PetrielloView 50 more rows,['sport']
Sport Obermeyer: Welcome,Foundation. Versatile Sport-Inspired. Shop Now. Men's Charger Jacket ... FIND A RETAILER. Locate a brand store or authorized retail partner in your area.,['sport']
Jaybird True Wireless Earbuds & In-Ear Bluetooth Headphones,Tarah Wireless Sport Headphones ... They may be used by those companies to build a profile of your interests and show you relevant adverts on other sites.,['sport']
Champs Sports: We Know Game,"With these cute and comfy looks from cozi, you'll look great and feel even better. Cozy up in all the latest drops from our new women's brand. SHOP NEW COZI.",['sport']
Challenger Sports - Your Total Soccer Solution | Challenger ...,Challenger Sports provides a comprehensive range of soccer services and products to players and ... The Largest Soccer Camp Company In North America.,['sport']
"EA SPORTS - Publisher of FIFA, Madden NFL, NHL, UFC ...","Remembering Coach John Madden. Electronic Arts Inc. Feb 15, 2022. Our dear friend John Madden passed away in late December. His passing was a tremendous¬†...",['sport']
TB12 Sports: Homepage,"Tom Brady co-founded TB12 on the belief that everyone can benefit from a smarter, more holistic approach to health and wellness. Tom's functional strength &¬†...",['sport']
Top Sports Companies 2022 | Built In,"Top Sports Companies ¬∑ PointsBet ¬∑ Caesars Digital ¬∑ SeatGeek ¬∑ Smarkets ¬∑ Catch Co. ¬∑ RECUR ¬∑ Tipico - North America ¬∑ Hydrow, Inc.",['sport']
"Hibbett | City Gear: Sneakers, Shoes, Athletic Clothing & More","Shop Hibbett | City Gear for sneakers, casual shoes, running shoes, athletic gear & more from top brands Nike, Jordan, adidas & more.",['sport']
Richardson Sports,"Shop for custom and blank caps, hats, and beanies for sports, ... Pro Model baseball cap back in 1987 was a major milestone for the company and the brand.",['sport']
MV Sport,Blankets ¬∑ Pro-Weave¬Æ Sweatshirt Blanket ¬∑ Solid Blankets ¬∑ Pattern Blankets ¬∑ Mens ¬∑ Sweatshirts ¬∑ Hooded ¬∑ Crewneck ¬∑ Full Zip ¬∑ Q Zip ¬∑ Bottoms.,['sport']
Alex Rodriguez is investing in a 'sports stock market' company,"1 day ago ‚Äî Alex Rodriguez is investing in a 'sports stock market' company ... Marc Lore, are supporting a new company called Mojo, which is aiming to¬†...",['sport']
Marucci Sports,"Marucci Sports built a reputation in baseball for quality, ... As a company founded and operated by current and former Big Leaguers, Marucci is dedicated to¬†...",['sport']
All-Star Sporting Goods¬Æ // Professional Baseball & Fastpitch ...,All-Star Sporting Goods¬Æ is known for having a strong reputation and presence among baseball and softball catchers. With a strong focus on quality and¬†...,['sport']
"Columbia Sportswear: Outdoor Clothing, Outerwear ...","Now 50% off select gear. Our Outerwear is Tested Tough in the Pacific Northwest. Shop for Jackets, Pants, Shirts, Shoes & more.",['sport']
Bristol Sport: Home,"bristolcitywfc @BristolBearsWW We're coming to Ashton Gate and it's going to be BIG Who can bringtwitter.com/i/web/status/1‚Ä¶o/6NZAas4YXJ¬†...Fri, Mar 11Bristol Flyers   vs   Sheffield ...",['sport']
MV Sport,Blankets ¬∑ Pro-Weave¬Æ Sweatshirt Blanket ¬∑ Solid Blankets ¬∑ Pattern Blankets ¬∑ Mens ¬∑ Sweatshirts ¬∑ Hooded ¬∑ Crewneck ¬∑ Full Zip ¬∑ Q Zip ¬∑ Bottoms.,['sport']
"SCHEELS: Sporting Goods, Clothing & Footwear | SCHEELS ...","Visit SCHEELS.com and shop sporting goods, clothing, hunting and fishing gear, and more. ... Chubbies and Billabong brand swimwear ¬∑ Various sunglasses.",['sport']
Sports Facilities Companies: Home,"Since 2003, Sports Facilities Companies has produced high performing sports and recreation facilities throughout the United States.",['sport']
"K2 Sports | Skiing, Snowboarding, Snowshoeing and Inline ...","COLLECTIVE STRENGTH. We are K2 Sports, a coalition of iconic brands creating unforgettable experiences for outdoor enthusiasts. Each brand maintains its¬†...",['sport']
All-Star Sporting Goods¬Æ // Professional Baseball & Fastpitch ...,All-Star Sporting Goods¬Æ is known for having a strong reputation and presence among baseball and softball catchers. With a strong focus on quality and¬†...,['sport']
Alex Rodriguez is investing in a 'sports stock market' company,"1 day ago ‚Äî Alex Rodriguez is investing in a 'sports stock market' company ... Marc Lore, are supporting a new company called Mojo, which is aiming to¬†...",['sport']
"Seattle Sports | Quality Gear for Camp, Paddle, Car Top ...","Founded in 1983, Seattle Sports is one of the few outdoor gear companies still making (some) of our gear in our own US factory (Nogales, AZ).",['sport']
Good Sports: Home,"Our mission is to give all kids the lifelong benefits of sport and physical ... +$81M Since 2003, Good Sports has donated over $81 million in brand new gear¬†...",['sport']
"NBC Sports | Live Streams, Video, News, Schedules, Scores ...","Watch the NFL's Sunday Night Football, NASCAR, the NHL, Premier League and much more. Live stream, watch highlights, get scores, see schedules,¬†...",['sport']
Nielsen Sports,The global leader in sponsorship media valuation and data analytics. Helping rights holders and brands optimize sponsorship portfolios.,['sport']
List of sporting goods manufacturers - Wikipedia,ManufacturerCountryFoundedFounder(s)Total ass...AdidasGermany18 August 1949Adolf Dassler‚Ç¨5.489 bil...AdmiralUnited Kingdom1914Cristopher Cook & Harold HurstAmazin SportsUnited States2021Jason PetrielloView 50 more rows,['sport']
Home of Ritter Sport,"For us, it doesn't take much for really good chocolate: the best ingredients, recipes reduced to the essentials, produced in harmony with people and nature.",['sport']
United Sports Brands,"Guided by our core strengths and mantra -- Prepare, Protect, Perform and Recover -- we support athletes with a commitment to innovation and authentic brand¬†...",['sport']
Jaybird True Wireless Earbuds & In-Ear Bluetooth Headphones,Tarah Wireless Sport Headphones ... They may be used by those companies to build a profile of your interests and show you relevant adverts on other sites.,['sport']
Company - SIGMA SPORT,"passion for sport and technology. ... SIGMA SPORT¬Æ Product Innovation. ... The company headquarters of SIGMA-ELEKTRO GmbH, founded in 1981, are located in¬†...",['sport']
Scoresports.com | Sports Uniforms | Sports Equipment,"Scoresports has everything you need for your soccer team. Shop for soccer uniforms, basketball uniforms, baseball uniforms & so much more. Shop Score today!",['sport']
"Through sport, we have the power to change lives. The ...",Being the best sports company in the world takes CREATIVITY. No great athlete succeeds by copying their predecessors' training plans and strategies.,['sport']
"Welcome to Sports, Inc.","Sports, Inc. was founded in 1965 in Lewistown, Montana, as a means for independent sporting goods retailers to grow and prosper in a competitive marketplace¬†...",['sport']
Running Shoes & Apparel | Running Gear,"CCPA ¬∑ Accessibility Statement ¬∑ Supply Chain Transparency ¬∑ Fraud Protection ¬∑ Terms ¬∑ Privacy Policy ¬∑ Sitemap. ¬© 2022 Brooks Sports, Inc.",['sport']
High Sierra Sport Co - Company Profile and News,"High Sierra Sport Company operates as a sports apparel company. The Company offers backpacks, luggage, active outdoors, duffels, and clearance sports goods.",['sport']
United Sports Brands,"Guided by our core strengths and mantra -- Prepare, Protect, Perform and Recover -- we support athletes with a commitment to innovation and authentic brand¬†...",['sport']
List of sporting goods manufacturers - Wikipedia,ManufacturerCountryFoundedFounder(s)Total ass...AdidasGermany18 August 1949Adolf Dassler‚Ç¨5.489 bil...AdmiralUnited Kingdom1914Cristopher Cook & Harold HurstAmazin SportsUnited States2021Jason PetrielloView 50 more rows,['sport']
Company - SIGMA SPORT,"passion for sport and technology. ... SIGMA SPORT¬Æ Product Innovation. ... The company headquarters of SIGMA-ELEKTRO GmbH, founded in 1981, are located in¬†...",['sport']
"Through sport, we have the power to change lives. The ...",Being the best sports company in the world takes CREATIVITY. No great athlete succeeds by copying their predecessors' training plans and strategies.,['sport']
Sportradar,"A global leader in delivering sports data and content to media companies, sports federations and the betting industry.",['sport']
"SALOMON : Running shoes and clothing, trail running, hiking ...","SALOMON International: Sporting goods for men, women and children. Ski boots and clothing. Snowboarding, trail running and hiking clothes & shoes.",['sport']
Reebok US | Reebok Official Website | Sport The Unexpected,Athletic Shoes and Classic Shoes Driven by Bold Movement ... Reebok's retro sneakers were born from sports out of the 80s and 90s.,['sport']
"Jabra: Wireless Headsets and Headphones for Office, Music ...",Headsets for office & call center with noise cancellation and superior sound - Bluetooth headsets and speakers - Wireless sport headphones - True wireless¬†...,['sport']
"Canoo: Electric Lifestyle, Sport and Working Vehicles",Canoo is creating a greener planet and reinventing the automotive industry by bringing bold electric vehicles to everyone.,['sport']
Catapult Sports,We create technology to help athletes and teams perform to their true potential.,['sport']
Sportradar,"A global leader in delivering sports data and content to media companies, sports federations and the betting industry.",['sport']
Sport.com - Crunchbase Company Profile & Funding,"Company Type For Profit. Contact Email marketing@sport.com. One of the pioneers in the mobile fitness apps market, Sport.com has successfully launched and¬†...Company Type: For ProfitLast Funding Type: Series C",['sport']
Old Sport Company | The Original Needlepoint Penny Loafer,"Shop our collection of premium Needlepoint Penny Loafers and Needlepoint Watch Bands. Original Designs, Premium Quality, and Free Shipping on all orders.",['sport']
Bryton Sport,Bryton Inc was founded by elite consumer electronics product development and marketing professionals. Combining strong R&D and innovative product management¬†...,['sport']
Synergy Sports: Home,"Synergy Sports is changing how sport is organised, played, coached, commercialized and experienced around the world. We help federations, leagues, clubs,¬†...",['sport']
"Seattle Sports | Quality Gear for Camp, Paddle, Car Top ...","Founded in 1983, Seattle Sports is one of the few outdoor gear companies still making (some) of our gear in our own US factory (Nogales, AZ).",['sport']
Bristol Sport: Home,"bristolcitywfc @BristolBearsWW We're coming to Ashton Gate and it's going to be BIG Who can bringtwitter.com/i/web/status/1‚Ä¶o/6NZAas4YXJ¬†...Fri, Mar 11Bristol Flyers   vs   Sheffield ...",['sport']
"Gopher Sport - PE, Sports & Fitness Equipment","Gopher Sport offers high-quality gym and exercise equipment, sports gear and resources. Shop now for your physical education equipment and curriculum needs!",['sport']
Woodward: Action Sports Experiential Company,Woodward is a global experiential action sports company on a mission to inspire the next generation of action sports and athletes.,['sport']
Water Skis & Water Skiing Equipment from HO Sports,HO Sports is known for carrying top of the line water skis and water skiing equipment. Bring your water sports to the next level with HO Sports!,['sport']
Tahoe Sport Fishing Co. | S. Lake Tahoe & Nevada Fishing ...,Tahoe Sport Fishing Co. is the largest fishing fleet on Lake Tahoe and offers private & public fishing charters in S. Lake Tahoe & Nevada.,['sport']
Ladder Supplements: Higher Performance For A Stronger You,What supplements are safe and effective? Find out + news and updates. Sign Up. Company.,['sport']
Eleiko: Strength Equipment Crafted for Performance,"... learning, and world-class sporting and community events under one roof. ... Eleiko, the Halmstad-based strength training company, is joining the event¬†...",['sport']
"Liberty Sport, Inc Company Profile | Fairfield, NJ","Find company research, competitor information, contact details & financial data for Liberty Sport, Inc of Fairfield, NJ. Get the latest business insights¬†...",['sport']
Mueller Sports Medicine,"We are the leader in Sports Medicine, developing better products to protect athletes and active individuals from injury and enhance their performance.",['sport']
Reebok US | Reebok Official Website | Sport The Unexpected,Athletic Shoes and Classic Shoes Driven by Bold Movement ... Reebok's retro sneakers were born from sports out of the 80s and 90s.,['sport']
"Mitsubishi Motors: Mitsubishi Cars, SUVs, Hatchbacks & EVs","FIND ADVENTURE IN EVERY DRIVE. The 2022 Outlander Sport was created to seek out adventure in style and comfort, whether it's a cross-country trek with the¬†...",['sport']
"Dog Training Collars for Hunting Dogs, Gun Dogs, Sporting ...","Hunting dog gear designed by sportsmen. Sporting dog training, tracking, and hunting information to get the most out of your next hunt.",['sport']
MOJO Sports Inc. | LinkedIn,"MOJO Sports Inc. | 1002 followers on LinkedIn. Making parents better coaches, kids better players, and sports more fun for everyone.",['sport']
SKLZ - Sporting Goods and Athletic Training Equipment,"VIDEOS BY SPORT ... SKLZ gives athletes the tools to improve both their sport-specific skill and ... 2022 Implus Footcare LLC, Inc. All rights reserved.",['sport']
Eleiko: Strength Equipment Crafted for Performance,"... learning, and world-class sporting and community events under one roof. ... Eleiko, the Halmstad-based strength training company, is joining the event¬†...",['sport']
Mueller Sports Medicine,"We are the leader in Sports Medicine, developing better products to protect athletes and active individuals from injury and enhance their performance.",['sport']
Reebok US | Reebok Official Website | Sport The Unexpected,Athletic Shoes and Classic Shoes Driven by Bold Movement ... Reebok's retro sneakers were born from sports out of the 80s and 90s.,['sport']
"Sportswear, Activewear, Sports clothes | 4F sport shop","4F is a brand that offers high quality sports clothing and accessories. Our characteristic feature is combination of quality, technology and fashionable¬†...",['sport']
"Mitsubishi Motors: Mitsubishi Cars, SUVs, Hatchbacks & EVs","FIND ADVENTURE IN EVERY DRIVE. The 2022 Outlander Sport was created to seek out adventure in style and comfort, whether it's a cross-country trek with the¬†...",['sport']
ActionSportGames - Exclusive licensed Airsoft guns and Airguns,ASG Steyr Arms Scout ¬∑ Product video ¬∑ ActionSportGames A/S ¬∑ ActionSportGames USA Inc. ¬∑ ActionSportGames UK Ltd.,['sport']
"Christy Sports: Rentals, Sales and Custom Boot Fitting + Patio","Oct 7, 2021 ‚Äî Christy Sports is the leader in skis, ski boots, snowboards and bindings. We carry top brands such as Salomon, Atomic, K2, Spyder, and Volkl¬†...",['sport']
"Dog Training Collars for Hunting Dogs, Gun Dogs, Sporting ...","Hunting dog gear designed by sportsmen. Sporting dog training, tracking, and hunting information to get the most out of your next hunt.",['sport']
MOJO Sports Inc. | LinkedIn,"MOJO Sports Inc. | 1002 followers on LinkedIn. Making parents better coaches, kids better players, and sports more fun for everyone.",['sport']
SPACS: What a Special Purpose Acquisition Company Means,"Feb 22, 2021 ‚Äî We've found are almost three dozen blank-check companies that are sports-specific or led by sports executives. Here are the details on each.",['sport']
Haircuts for Men & Boys | Check-in Online | Sport Clips 2021,"Our services are available to all members of the public regardless of race, gender or sexual orientation. ¬© Copyright 2020 Sport Clips, Inc. All Rights Reserved¬†...",['sport']
Sports Marketing Agency Companies: 27 You Should Know ...,"A good sports marketing company can be hard to come by, but our sports marketing agency has a best in class geofencing advertising solution.",['sport']
Woodward: Action Sports Experiential Company,Woodward is a global experiential action sports company on a mission to inspire the next generation of action sports and athletes.,['sport']
Mondo Worldwide ‚Äì Sport & Rubber Gym Flooring Systems,"Mondo is the premiere sport, gymnasium, Olympic & artificial turf flooring company allowing athletes to break world records and overcome their limits.",['sport']
"SBNation.com | Sports news, video, live coverage, community","Come fan with us. SB Nation is the largest independent sports media brand, consisting of SBNation.com, MMAFighting.com and over 300 fan-centric team¬†...",['sport']
OutKick - Fearless Sports Media Company Founded by Clay ...,"OutKick authentically covers the latest sports, media, and political news everyday with articles, videos, podcasts, community and more. DBAP.",['sport']
"Sportswear, Activewear, Sports clothes | 4F sport shop","4F is a brand that offers high quality sports clothing and accessories. Our characteristic feature is combination of quality, technology and fashionable¬†...",['sport']
ActionSportGames - Exclusive licensed Airsoft guns and Airguns,ASG Steyr Arms Scout ¬∑ Product video ¬∑ ActionSportGames A/S ¬∑ ActionSportGames USA Inc. ¬∑ ActionSportGames UK Ltd.,['sport']
"Christy Sports: Rentals, Sales and Custom Boot Fitting + Patio","Oct 7, 2021 ‚Äî Christy Sports is the leader in skis, ski boots, snowboards and bindings. We carry top brands such as Salomon, Atomic, K2, Spyder, and Volkl¬†...",['sport']
SPACS: What a Special Purpose Acquisition Company Means,"Feb 22, 2021 ‚Äî We've found are almost three dozen blank-check companies that are sports-specific or led by sports executives. Here are the details on each.",['sport']
SPACS: What a Special Purpose Acquisition Company Means,"Feb 22, 2021 ‚Äî We've found are almost three dozen blank-check companies that are sports-specific or led by sports executives. Here are the details on each.",['sport']
