titles,summaries,terms
"Best Fintech 2022: See The Top Digital Wallets, Crypto Apps ...",3 days ago ‚Äî The fintech revolution is going strong as all kinds of financial companies adopt new technologies. The pandemic spurred rapid innovation and¬†...,['fintech']
Goldman Sachs to Present at the Wolfe FinTech Forum 2022,"23 hours ago ‚Äî Hari Moorthy, Global Head of Transaction Banking in the Investment Banking Division, is scheduled to present via webcast at the Wolfe FinTech¬†...",['fintech']
Beyond Fintech: A Pragmatic Assessment Of Disruptive ...,"Aug 22, 2017 ‚Äî For years Fintech has been the hottest topic of discussion in financial services, with incumbents, regulators, and consumers all asking the¬†...",['fintech']
Rosenblatt Securities FinTech Summit 2021,"Rosenblatt Securities 2021 FinTech Summit: Building Tomorrow's Marketplaces. Conference themes are: Marketplaces of Tomorrow, Digital Asset Infrastructure,¬†...",['fintech']
What is FinTech? | HuffPost null,"Feb 13, 2017 ‚Äî FinTech companies operate in dozens of countries, and are slowly chipping away at pieces of the financial services industry, providing products¬†...",['fintech']
"Investors Can't Get Enough of Fintech, Here's Why | NetSuite","Nov 4, 2020 ‚Äî Fintech applies technology to payments, lending, insurance and more to improve performance and create new services. ¬∑ Both tech companies and¬†...",['fintech']
Fintech startup Money View raises USD 75 million Series D,1 day ago ‚Äî The company is now valued at USD 625 million. Money View is an online credit platform that offers personalised credit products like instant¬†...,['fintech']
"BNPL fintech attracts $11.1 million, unveils free services in the ...",3 hours ago ‚Äî The Dutch startup in3 will use the funding to boost the technology platform and invest in improved customer satisfaction.,['fintech']
What is Fintech? The Best Fintech Apps and Why ... - Status200,"Apr 28, 2021 ‚Äî Fintech is an abbreviation of ‚ÄúFinancial Technology‚Äù. This refers to the application of emerging technical innovations to financial products¬†...",['fintech']
Jennifer Nayar Tracks Evolving Fintech Space - Markets Media,2 days ago ‚Äî Jennifer Nayar Tracks Evolving Fintech Space ... This is the first of a series of articles profiling previous Markets Choice Award winners.,['fintech']
How Ag Fintech Is Transforming Brazilian Agribusiness and Its ...,"The next great revolution in Brazilian agriculture will be access to rural credit, says contributing writer Mauricio Netto. Here's an inside look at three¬†...",['fintech']
"Fintech: Ecosystem, business models, investment decisions","by I Lee ¬∑ 2018 ¬∑ Cited by 761 ‚Äî Financial technology (fintech) is recognized as one of the most important innovations in the financial industry and is evolving at a rapid speed, driven in part¬†...",['fintech']
What the FinTech? | S.3 Episode 2 | Build banking better,"6 hours ago ‚Äî In this episode of the What the Fintech? podcast, we're joined by Tony Coleman, chief technology officer at cloud banking platform Temenos.",['fintech']
30 The Growing Role of FinTech and Robo-advisors - De ...,30 The Growing Role of FinTech and Robo-advisors. From the book De Gruyter Handbook of Personal Finance. Michelle Cull.,['fintech']
How Fintech Became a Hit in Brazil - WSJ,"Dec 5, 2021 ‚Äî With its fast growth, Nubank has become the poster child of the fintech boom in Latin America. But it isn't alone. The digital technology¬†...",['fintech']
Is the Fintech time - Shareppy Internacional,"Jun 2, 2021 ‚Äî For 12 years now, Fintech has been breaking into financial models, changing forever the digitization of different services, ranging from¬†...",['fintech']
"Fintech: Ecosystem, business models, investment decisions","by I Lee ¬∑ 2018 ¬∑ Cited by 761 ‚Äî Financial technology (fintech) is recognized as one of the most important innovations in the financial industry and is evolving at a rapid speed, driven in part¬†...",['fintech']
How Ag Fintech Is Transforming Brazilian Agribusiness and Its ...,"The next great revolution in Brazilian agriculture will be access to rural credit, says contributing writer Mauricio Netto. Here's an inside look at three¬†...",['fintech']
What the FinTech? | S.3 Episode 2 | Build banking better,"6 hours ago ‚Äî In this episode of the What the Fintech? podcast, we're joined by Tony Coleman, chief technology officer at cloud banking platform Temenos.",['fintech']
How Fintech Became a Hit in Brazil - WSJ,"Dec 5, 2021 ‚Äî With its fast growth, Nubank has become the poster child of the fintech boom in Latin America. But it isn't alone. The digital technology¬†...",['fintech']
30 The Growing Role of FinTech and Robo-advisors - De ...,30 The Growing Role of FinTech and Robo-advisors. From the book De Gruyter Handbook of Personal Finance. Michelle Cull.,['fintech']
Is the Fintech time - Shareppy Internacional,"Jun 2, 2021 ‚Äî For 12 years now, Fintech has been breaking into financial models, changing forever the digitization of different services, ranging from¬†...",['fintech']
A Framework for FinTech | whitehouse.gov - Obama White ...,"Jan 13, 2017 ‚Äî Policy Objectives and FinTech Principles ¬∑ think broadly about the financial ecosystem; ¬∑ start with the consumer in mind; ¬∑ promote safe financial¬†...",['fintech']
SoFi stock soars after fintech company gives upbeat earnings,"Mar 1, 2022 ‚Äî Shares of SoFi Technologies Inc. were soaring 18% in after-hours trading Tuesday after the financial-technology company exceeded¬†...",['fintech']
FinTech in 2022: Top predictions and trends - Digipay.guru,"Jan 10, 2022 ‚Äî FinTech is transforming the banking and payments industry at a lightning speed. Read this blog to know about FinTech's future trends an¬†...",['fintech']
Policy Principles for Fintech | ITIF,"Oct 18, 2016 ‚Äî Alternative lending is not the only business-model innovation, however, fintech companies are also changing their business models for payments,¬†...",['fintech']
FinTech in 2022: Top predictions and trends - Digipay.guru,"Jan 10, 2022 ‚Äî FinTech is transforming the banking and payments industry at a lightning speed. Read this blog to know about FinTech's future trends an¬†...",['fintech']
SoFi stock soars after fintech company gives upbeat earnings,"Mar 1, 2022 ‚Äî Shares of SoFi Technologies Inc. were soaring 18% in after-hours trading Tuesday after the financial-technology company exceeded¬†...",['fintech']
The Parabolic Rise of Fintech in 2022 - California Business ...,"It wasn't too long ago the word ""fintech"" was unheard of. Now, it's a term that has become synonymous with global financial ecosystems.",['fintech']
Policy Principles for Fintech | ITIF,"Oct 18, 2016 ‚Äî Alternative lending is not the only business-model innovation, however, fintech companies are also changing their business models for payments,¬†...",['fintech']
"Treasury Releases Report on Nonbank Financials, Fintech ...","Jul 31, 2018 ‚Äî Treasury Releases Report on Nonbank Financials, Fintech, and Innovation ¬∑ Embrace the efficient and responsible use of consumer financial data¬†...",['fintech']
What Is Fintech? | Bankrate,"Fintech aims to reimagine traditional banking services and products with the customer in mind. Here's everything you need to know.Sep 2, 2020 ¬∑ Uploaded by Bankrate",['fintech']
What is Fintech? - Vedanvi,"‚ÄúFinancial technology, also known as FinTech, is a line of business based on using software to provide financial services. Fintech companies are generally start¬†...",['fintech']
Jennifer Nayar Tracks Evolving Fintech Space - Traders ...,"8 hours ago ‚Äî She is excited about the fintech space, saying there's always new and interesting problems to solve with technology.",['fintech']
Does Fintech improve access to finance?,"May 14, 2021 ‚Äî Fintech's disruptive technologies. Fintech is disruptive because its technological advantage enables it to provide alternative financing and¬†...",['fintech']
What Is Fintech? | Bankrate,"Fintech aims to reimagine traditional banking services and products with the customer in mind. Here's everything you need to know.Sep 2, 2020 ¬∑ Uploaded by Bankrate",['fintech']
Does Fintech improve access to finance?,"May 14, 2021 ‚Äî Fintech's disruptive technologies. Fintech is disruptive because its technological advantage enables it to provide alternative financing and¬†...",['fintech']
What exactly is and isn't Fintech? How to best prepare ... - Reddit,"Jul 27, 2018 ‚Äî But when you hear fintech today, it mostly means startups that are trying to make money in financial services industry (either by competing or¬†...",['fintech']
Fintech Finance's Power Players | Institutional Investor,"Nov 13, 2018 ‚Äî New York is arguably the world capital of fintech, with its concentration of financial services companies and the technology incubation¬†...",['fintech']
US FinTech - The US FinTech Community,"US FinTech - the number one source of FinTech news in the US, including a comprehensive list of US FinTech companies and resources.",['fintech']
Marketplace Lending: Fintech in Consumer and ... - CRS Reports,lending industry that uses innovative financial technology (fintech) to make loans to consumers and small businesses. Although marketplace lending is small¬†...,['fintech']
Top 10 countries leading in fintech | PaySpace Magazine,"Jul 17, 2020 ‚Äî 10 fintech centers worldwide. According to the Global Fintech Index City Rankings 2020, the top 10 fintech countries are: The USA; The UK¬†...",['fintech']
The Global Fintech Index 2020 - Findexable,2 FINTECH NATIONS. 20. Fintech Rising? The dawn of non-traditional financial centres. 21. Fintech Country Rankings. 26. Diversity in finance.,['fintech']
Robinhood Is a Perfect Example of Fintech's Insidious Power,"Jan 31, 2021 ‚Äî Fintech is neither inherently good nor bad; rather, like any technology, its potential impact on society is closely tied to the policy decisions¬†...",['fintech']
What is FinTech? - GeeksforGeeks,"Dec 6, 2019 ‚Äî FinTech consists of two words, ‚ÄúFin‚Äù and ‚ÄúTech‚Äù refers to Financial Technology. Financial Technology is an emerging trend of technology in¬†...",['fintech']
FinTech: Law and Regulation - Page 421 - Google Books Result,"Madir, Jelena ¬∑ 2021 ¬∑ ‚ÄéLawIoT, cloud computing, DLT, AI and machine learning.1 This chapter proposes classifying FinTech patents by the type of financial service that the relevant¬†...",['fintech']
Institutional Arrangements for Fintech Regulation and ...,"Mr.Charles R Taylor, ‚ÄéChristopher Wilson, ‚ÄéEija Holttinen ¬∑ 2020 ¬∑ ‚ÄéBusiness & EconomicsIn some jurisdictions, supervisory authorities face questions regarding whether and, indeed, which, financial regulation is applicable to fintech firms¬†...",['fintech']
https://lendingtimes.wpengine.com/?p=11181&preview...,No information is available for this page.,['fintech']
"Regulating FinTech in Asia: Global Context, Local Perspectives","Mark Fenwick, ‚ÄéSteven Van Uytsel, ‚ÄéBi Ying ¬∑ 2020 ¬∑ ‚ÄéLaw2 Fintech in South-East Asia, Driven by Ridesharing Platforms 2.1 Fintech, Fintech Products and Fintech Firms Fintech is 'the delivery of financial products¬†...",['fintech']
"Central Bank Risk Management, Fintech, and Cybersecurity","Mr. Ashraf Khan, ‚ÄéMajid Malaika ¬∑ 2021 ¬∑ ‚ÄéBusiness & EconomicsAdditionally, fintech is seen as potentially influencing financial stability as well. The fintech business in Indonesia is classified into five categories:¬†...",['fintech']
The Palgrave Handbook of FinTech and Blockchain,"Maurizio Pompella, ‚ÄéRoman Matousek ¬∑ 2021 ¬∑ ‚ÄéBusiness & Economicsin their entirety, and therefore may dissuade many incumbent financial service firms from embracing and deploying fintech solutions 'en masse'.",['fintech']
https://communitech.cmail19.com/t/d-i-ntugjl-l-c/,No information is available for this page.,['fintech']
MOLEX „Éò„ÉÉ„ÉÄ „ÉØ„Ç§„É§„Éè„Ç¶„Ç∏„É≥„Ç∞ 504051-0401 - Fintech Austin,843ÂÜÜ MOLEX „Éò„ÉÉ„ÉÄ „ÉØ„Ç§„É§„Éè„Ç¶„Ç∏„É≥„Ç∞ 504051-0401 Áî£Ê•≠„ÉªÁ†îÁ©∂ÈñãÁô∫Áî®ÂìÅ „Ç®„É¨„ÇØ„Éà„É≠„Éã„ÇØ„ÇπÈÉ®ÂìÅ ÈÖçÁ∑ö„ÉªÊé•Á∂öÈÉ®ÂìÅ „Ç≥„Éç„ÇØ„Çø ÂêåËª∏„Ç≥„Éç„ÇØ„Çø.,['fintech']
Technology - Wikipedia,"Technology is the sum of any techniques, skills, methods, and processes used in the production of goods or services or in the accomplishment of objectives,¬†...",['tech']
"technology | Definition, Examples, Types, & Facts | Britannica","Technology, the application of scientific knowledge to the practical aims of human life or, as it is sometimes phrased, to the change and manipulation of¬†...",['tech']
Technology - BBC News,"Get the latest BBC Technology News: breaking news and analysis on computing, the web, blogs, games, gadgets, social media, broadband and more.",['tech']
"Technology news, articles and features | New Scientist",Get the latest technology and engineering news and insight. Learn about the next steps for everything from AI and smart devices to mechanical engineering.,['tech']
Georgia Tech,"Georgia Tech (Georgia Institute of Technology) is a technology-focused college in Atlanta, Ga, and one of the top research universities in the USA.",['tech']
Technology - The New York Times,"Technology industry news, commentary and analysis, with reporting on big tech, startups, and internet culture.",['tech']
Technology Definition & Meaning - Merriam-Webster,The meaning of TECHNOLOGY is the practical application of knowledge especially in a particular area : engineering. How to use technology in a sentence.,['tech']
MIT Technology Review,"While the pandemic has made clear the critical role of technology, it has also revealed major gaps in data accessibility, underrepresentation within tech¬†...",['tech']
Technology Definition & Meaning | Dictionary.com,"technology ¬∑ the branch of knowledge that deals with the creation and use of technical means and their interrelation with life, society, and the environment,¬†...",['tech']
Technology - Scientific American,"Scientific American is the essential guide to the most awe-inspiring advances in science and technology, explaining how they change our understanding of the¬†...",['tech']
Rochester Institute of Technology | RIT,"Founded in 1829, Rochester Institute of Technology is a privately endowed, coeducational university with nine colleges emphasizing career education and¬†...",['tech']
Technology: Latest Tech News Articles Today | AP News,Don't miss an update on the latest tech news from The Associated Press. AP News has everything you need to know for technology news today.,['tech']
Florida Institute of Technology,"Florida Tech is a tier 1 ranked university with programs in science, engineering, aeronautics, business, humanities, psychology, and communication.",['tech']
Home | www.caltech.edu,The mission of the California Institute of Technology is to expand human knowledge and benefit society through research integrated with education.,['tech']
15 Synonyms & Antonyms for TECHNOLOGY | Thesaurus.com,"Find 15 ways to say TECHNOLOGY, along with antonyms, related words, and example sentences at Thesaurus.com, the world's most trusted free thesaurus.",['tech']
Massachusetts Institute of Technology: MIT,Massachusetts Institute of Technology ¬∑ Education ¬∑ Research ¬∑ Innovation ¬∑ Admissions + Aid ¬∑ Campus Life ¬∑ News ¬∑ Alumni ¬∑ About MIT,['tech']
What is technology? - OpenLearn - The Open University,"3. It involves organized ways of doing things. It covers the intended and unintended interactions between products (machines, devices, artifacts) and the people¬†...",['tech']
Technology definition and meaning | Collins English Dictionary,"Technology refers to methods, systems, and devices which are the result of scientific knowledge being used for practical purposes.Dec 12, 2017 ¬∑ Uploaded by Collins A-Z",['tech']
Stevens Institute of Technology,"A private research university in Hoboken, NJ, Stevens Institute of Technology offers undergraduate and graduate programs in the sciences, technology,¬†...",['tech']
Technology - The Washington Post,TECHNOLOGY ¬∑ Three cybersecurity companies to offer free protection to U.S. hospitals and utilities amid concerns of hacking attacks ¬∑ Tech in Your Life ¬∑ TikTok¬†...,['tech']
"Technology news, features and analysis from Guardian US","Latest Technology news, comment and analysis from the Guardian, the world's leading liberal voice.",['tech']
Technology : NPR,"Latest technology news and breakthroughs in technology, science, and industry. Download the NPR Technology podcast and Technology RSS feed.",['tech']
What is technology? - OpenLearn - The Open University,"3. It involves organized ways of doing things. It covers the intended and unintended interactions between products (machines, devices, artifacts) and the people¬†...",['tech']
"Technology Articles, Technological News | Popular Science","Popular Science technology stories about devices, apps, robots, and everything else that makes technology essential to your modern life.",['tech']
Technology - Reuters,Technology ; LitigationWall Street regulator proposes listed companies spell out cyber breaches within four days ¬∑ 3:15 PM PST . Updated an hour ago ; ChargedAuto¬†...,['tech']
Technology | Inc.com,"Advice for business owners and entrepreneurs on small business websites, Internet and online businesses, business software, PCs, laptops, netbooks,¬†...",['tech']
Oregon Institute of Technology,"Oregon Tech offers bachelor and masters degree programs in engineering, health technology, information technology, management, communications,¬†...",['tech']
Tech News - Latest Technology Headlines and Trends on CNN,"View the latest technology headlines, gadget and smartphone trends, and insights from tech industry leaders.",['tech']
TECHNOLOGY | definition in the Cambridge English Dictionary,"Mar 2, 2022 ‚Äî new machinery and equipment that has been developed using scientific knowledge or processes: Roll-out of the new technology has been dogged by¬†...",['tech']
"Wentworth: Technology-focused University in Boston, MA ...","Wentworth Institute of Technology is a technology university in Boston with five schools focused on Engineering, Computing, Design and Management.",['tech']
Bloomberg Technology,"... and markets news, data, analysis, and video to the world, featuring stories from Businessweek and Bloomberg News on everything pertaining to technology.",['tech']
Technology - The Atlantic,"Technology news and analysis from The Atlantic, with expansive reporting on the biggest tech companies, social media, and internet culture.",['tech']
New Jersey Institute of Technology |,"New Jersey Institute of Technology is the state's public polytechnic university and a leader in STEM education, research, economic development, and service.",['tech']
Technology | Financial Times,"News, analysis and comment from the Financial Times, the world ºs leading global business publication.",['tech']
Bloomberg Technology - Twitter,"Breaking news & analysis on the global technology industry. Watch #BTECH weekdays at 5pET, 2pPT. Listen to our podcast https://t.co/8kX0blvfVk.",['tech']
Olight Ecommerce Technology Recalls Flashlights Due to ...,1 day ago ‚Äî Consumers should immediately stop using the recalled flashlights and contact Olight for a full refund in the form of a store credit or for a¬†...,['tech']
Technology and Science News - ABC News,"Get the latest science news and technology news, read tech reviews and more at ABC News.",['tech']
Olight Ecommerce Technology Recalls Flashlights Due to ...,1 day ago ‚Äî Consumers should immediately stop using the recalled flashlights and contact Olight for a full refund in the form of a store credit or for a¬†...,['tech']
"Technology Articles, Technological News | Popular Science","Popular Science technology stories about devices, apps, robots, and everything else that makes technology essential to your modern life.",['tech']
Technology and Science News - ABC News,"Get the latest science news and technology news, read tech reviews and more at ABC News.",['tech']
Technology - Sloan Foundation,Sloan's programs in Digital Technology explore how the internet and computing technology are creating new opportunities to empower the scientific enterprise and¬†...,['tech']
Tech - CNBC,"Business news related to the technology industry, including Apple, Amazon, Microsoft, Google, and Facebook, plus consumer electronics, start-ups,¬†...",['tech']
TechCrunch ‚Äì Startup and Technology News,"TechCrunch - Reporting on the business of technology, startups, venture capital funding, and Silicon Valley.",['tech']
Tech CU ‚Äì Silicon Valley and SF Bay Area - Tech CU,Technology Credit Union serving more than 125000 members throughout the San Francisco Bay Area and Silicon Valley. Founded in 1960 by a group of¬†...,['tech']
Technology - Axios,"Technology. Why it matters: From the Valley to D.C., Big Tech players like Facebook, Google and Amazon are under more scrutiny than ever as new¬†...",['tech']
Information Technology Online Degrees - Davenport University,"At Davenport University's College for Technology students can earn degrees in information technology, pursue computer engineer degrees or a computer¬†...",['tech']
Fashion Institute of Technology,"FIT, a part of the State University of New York, has been an internationally recognized leader in career education in design, fashion, business,¬†...",['tech']
Technologies ‚Äì Privacy & Terms - Google's policies,"Technologies. At Google, we pursue ideas and products that often push the limits of existing technology. As a company that acts responsibly, we work hard to¬†...",['tech']
"Technology: Latest News, Top Stories & Analysis - Politico","Latest news, headlines, analysis, photos and videos on Technology.",['tech']
/r/Technology - Reddit,r/technology: Subreddit dedicated to the news and discussions about the creation and use of technology and its surrounding issues.,['tech']
Technology - Education Week,"Browse and register for free professional development on classroom technology, student data, ed-tech policy, future of work, personalized learning,¬†...",['tech']
Science + Technology ‚Äì Views & Research ‚Äì The Conversation,"Scientists have been testing captive and wild animals for the coronavirus since the pandemic began. Only a few wild species are known to carry the virus,¬†...",['tech']
Indiana Tech,Indiana Tech programs have earned accreditation from respected organizations like the Accreditation Board for Engineering and Technology ¬∑ // Featured News,['tech']
technology - architecture & design magazine - Designboom,"technology on designboom explores and examines the cutting edge developments happening around the globe, spotlighting a mix of innovative projects.",['tech']
Professional Training & Digital Literacy | GSU Technology,"You'll grow digital skills and develop your portfolio, with support and guidance from a diverse group of technology professionals in Atlanta's education,¬†...",['tech']
Tech Xplore - Technology and Engineering news,"Tech Xplore covers the latest engineering, electronics and technology advances.",['tech']
Tech - The Verge,"From top companies like Google and Apple to tiny startups vying for your attention, Verge Tech has the latest in what matters in technology daily.",['tech']
Technology Mechanism - UNFCCC,"Within the UN Climate Change process, countries have confirmed the importance of enhancing technology development and transfer to developing countries.",['tech']
Types of Technology: Definitions and Examples | Indeed.com,"May 20, 2021 ‚Äî For example, the internet makes communication easier and more efficient. While a single piece of technology often overlaps into different areas,¬†...",['tech']
Technology Science: Home,Studies that characterize a technology-society clash or present an approach to better harmonize technology and society are especially welcomed. Papers can come¬†...,['tech']
Technology | NASA,"NASA.gov brings you the latest images, videos and news from America's space agency. Get the latest on all things technology related from NASA.",['tech']
Technology Innovation - Bonneville Power Administration,"BPA partners with electric utilities, nonprofits, research organizations, and technology developers on research that is aligned with Agency Strategic¬†...",['tech']
Technology ‚Äì Work Life by Atlassian,Technology is changing faster than ever. We report on the latest trends and methodologies to help you stay ahead of the curve.,['tech']
Science & technology | The Economist,"Science & technology from The Economist. You've seen the news, now discover the story.",['tech']
"Computers, Monitors & Technology Solutions | Dell USA","Shop the latest Dell computers & technology solutions. Laptops, desktops, gaming pcs, monitors, workstations & servers. FREE & FAST DELIVERY.",['tech']
"Technology | Insights, case studies & services | EY - Global","Discover EY's technology insights, people & services and how they can help your business improve performance, manage risk and drive innovation.",['tech']
