titles,summaries,terms
College of Science - Biotechnology - UAH,Welcome to Biotechnology Science and Engineering The Graduate Program in Biotechnology Science and Engineering is an Interdisciplinary Program with faculty¬†...,['biotech']
Biotech and Life Sciences | Empire State Development,"New York has some of the most successful biotech incubators in the U.S., and is ranked #2 in the U.S. in funding biotech & life sciences research¬†...",['biotech']
Biotechnology - Frederick Community College,,['biotech']
Biotechnology Progress - Wiley Online Library,"Journal Overview. Biotechnology Progress, an official, bimonthly publication of the American Institute of Chemical Engineers and its technological community¬†...",['biotech']
Agricultural Biotechnology | FDA,"Feb 17, 2022 ‚Äî GMO foods have been available to consumers since the early 1990s. Since then, the FDA, EPA, and USDA have worked together to ensure that¬†...",['biotech']
Biotech Blueprint on the AWS Cloud,Biotech Blueprint is a reference architecture for scientific applications and is for biotechnology companies that want to manage their software on the cloud.,['biotech']
Biotechnology - Georgia Tech School of Chemical ...,"Biotechnology research combines biological sciences, chemistry, and chemical engineering to solve practical problems in the fields of medicine, agriculture,¬†...",['biotech']
Biotechnology - SV Health Investors,Biotech. We seek breakthroughs that have the power to change the lives of millions. SV Biotechnology Cells Graphic.,['biotech']
GSAS Harvard Biotech Club,"The Harvard Biotech Club is a student-led organization on a mission to bridge the gap between industry and academia, empowering students to become future¬†...",['biotech']
Puma Biotechnology,"Puma Biotechnology, Inc. is a biopharmaceutical company dedicated to the acquisition, development and commercialization of novel therapeutics for the¬†...",['biotech']
Cornell Institute of Biotechnology | Cornell University,"Providing know-how, expert services, product development, instrumentation, and commercialization in support of life science research, with the goal of using¬†...",['biotech']
"Blue Heron Biotech, LLC - Gene Synthesis - Custom DNA","Taking pride in high quality of service; Blue Heron specializes in the synthesis of large genes, complex sequences, hairpins, repeats, and GC rich DNA.",['biotech']
Biotech - San Diego Regional EDC,Research and Development in Biotechnology (except Nanobiotechnology) ¬∑ In-Vitro Diagnostic Substance Manufacturing ¬∑ Pharmaceutical Preparation Manufacturing.,['biotech']
"Biotechnology, BS | UVU","The Bachelor's Degree in Biotechnology will prepare students to enter the field of research, education, pharmaceuticals, forensics, and a variety of other¬†...",['biotech']
Cornell Institute of Biotechnology | Cornell University,"Providing know-how, expert services, product development, instrumentation, and commercialization in support of life science research, with the goal of using¬†...",['biotech']
"Blue Heron Biotech, LLC - Gene Synthesis - Custom DNA","Taking pride in high quality of service; Blue Heron specializes in the synthesis of large genes, complex sequences, hairpins, repeats, and GC rich DNA.",['biotech']
Biotech - San Diego Regional EDC,Research and Development in Biotechnology (except Nanobiotechnology) ¬∑ In-Vitro Diagnostic Substance Manufacturing ¬∑ Pharmaceutical Preparation Manufacturing.,['biotech']
"Biotechnology, BS | UVU","The Bachelor's Degree in Biotechnology will prepare students to enter the field of research, education, pharmaceuticals, forensics, and a variety of other¬†...",['biotech']
Biotechnology Department - Ohlone College,"""Ohlone's biotech program is one of the best in the nation."" - Dr. Elaine Johnson, National Director, BioLink . Did You Know‚Ä¶? Community colleges offer¬†...",['biotech']
Biotech/Pharmaceutical - Charles River Laboratories,Biotech/Pharmaceutical. We are committed to providing pharmaceutical and biotechnology companies solutions for the discovery and development of new¬†...,['biotech']
Pharma and Biotech | NSF International,"Our experts help pharmaceutical and biotech companies establish or remediate quality systems, mitigate risks and achieve sustainable compliance.",['biotech']
Optimal Biotech Group Scientific Equipment Supplier | Biotech ...,"Bioprocess, food & beverage, and USP/WFI scientific equipment supplier in Belmont, CA. Quote your project by calling 650-376-3837. For GMP...",['biotech']
Biotechnology | Biology library | Science | Khan Academy,"Learn how biotechnology can include a wide range of products and applications, from penicillin to beer to gene therapy, and get an overview of modern DNA¬†...",['biotech']
BioTech USA,Supports sport and healthy lifestyle by offering high quality food supplements. Choose your country and find your nearest Store or Shop Online.,['biotech']
BioTech USA,Supports sport and healthy lifestyle by offering high quality food supplements. Choose your country and find your nearest Store or Shop Online.,['biotech']
InnovATEBIO | National Biotechnology Education Center,Search form ¬∑ High School Network ¬∑ ATE Biotech Projects ¬∑ Biotech Hubs ¬∑ College Biotech Programs ¬∑ Undergraduate Research ¬∑ Leadership Institute ¬∑ Students & Alumni.,['biotech']
SQZ Biotech,"SQZ BIOTECH. Empowering Cells to Change Lives. A clinical-stage biotechnology company developing transformative cell therapies for patients with cancer,¬†...",['biotech']
"Kingfisher Biotech: Recombinant Proteins, Polyclonal ...","Kingfisher Biotech, Inc. Animals. Tools for Animal Health & Animal Model Research. All; bullet; Bat; bullet; Bovine; bullet¬†...",['biotech']
Biotech Showcase: The investor conference for innovators,Biotech Showcase‚Ñ¢ is an investor conference devoted to providing private and public biotechnology and life sciences companies with an opportunity to present¬†...,['biotech']
Janssen: Pharmaceutical Companies of Johnson & Johnson,Explore Janssen's innovative medical research & pharmaceutical product development practices to see how Janssen is creating a future where disease is a¬†...,['biotech']
3 Biotech | Home - Springer,3 Biotech is a hybrid journal that publishes results of the latest research related to the study and application of biotechnology to Medicine and Biomedical¬†...,['biotech']
Biotechnology | Roger Williams University,"... toward graduate school or a career in biomedical research, biotech or the pharmaceutical industry. Degree Requirements. Certificate in Biotechnology.",['biotech']
Creating a #BiobasedFuture | BRAIN Biotech AG,"We are a specialist in industrial biotechnology. With our innovative bio-based products and solutions, we contribute to value creation ‚Äì from concept to‚Ä¶",['biotech']
Biotechnology and Pharmaceuticals - CNBC,"Latest news for pharmaceuticals, biotechnology and life sciences. ... Biotech and Pharma. Health ¬∑ Hospitals ¬∑ Biotech and Pharma ¬∑ Health Insurance¬†...",['biotech']
Creating a #BiobasedFuture | BRAIN Biotech AG,"We are a specialist in industrial biotechnology. With our innovative bio-based products and solutions, we contribute to value creation ‚Äì from concept to‚Ä¶",['biotech']
Welcome ‚Ä¢ Office of Biotechnology ‚Ä¢ Iowa State University,Recent Posts. Upcoming Biotech Seminars ¬∑ Spring 2022 Molecular Biology Techniques Courses Offered ¬∑ Three New Members Join Biotechnology Council ¬∑ Outreach¬†...,['biotech']
Trends in Biotechnology: Cell Press,"Trends in Biotechnology publishes commissioned, peer-reviewed articles on the applied biological sciences.",['biotech']
Sequentia biotech: genomics and post-genomics data ...,"Sequentia Biotech is a bioinformatics company that offers services for healthcare, pharma, agriculture, industry and environment.",['biotech']
Welcome to Biotech | Biotech,The Roy J. Carver Biotechnology Center provides a state-of-the-art research infrastructure to investigators. Our portfolio includes core research facilities¬†...,['biotech']
CBG Biotech | Solvent Recovery & Recycling Systems,CBG Biotech provides industry-leading solvent recycling & recovery solutions for chemical waste management. Learn how our solvent systems can help you.,['biotech']
Center for Biotechnology and Interdisciplinary Studies: Home ...,at Rensselaer Polytechnic Institute is a powerhouse of fundamental and translational research tackling the most pressing health care and biotechnology¬†...,['biotech']
UF ICBR ‚Äì your pursuit is what drives us.,"The Interdisciplinary Center for Biotechnology Research is the University of Florida's premium core research facility, providing world-class service in the¬†...",['biotech']
Center for Biotechnology Education,The Johns Hopkins University Krieger School of Arts and Sciences created the Center for Biotechnology Education to engage diverse audiences in the world of¬†...,['biotech']
Home ¬ª Pennsylvania Biotechnology Center,"The nonprofit Pennsylvania Biotechnology Center (PABC), one of the nation's most successful life sciences incubators, is proud to announce that IGM Biosciences¬†...",['biotech']
CBG Biotech | Solvent Recovery & Recycling Systems,CBG Biotech provides industry-leading solvent recycling & recovery solutions for chemical waste management. Learn how our solvent systems can help you.,['biotech']
Genetic Engineering and Biotechnology News: GEN,"Get the latest news and information on genetic engineering and biotechnology including analysis, features, webinars, podcasts, and more.",['biotech']
Northway Biotech: Global Flexible Biologics CDMO,"Northway Biotech is a world-class contract development and manufacturing organization (CDMO), specializing in the development and manufacturing of¬†...",['biotech']
Biotechnology Industry in North Carolina | EDPNC,"North Carolina is home leading research facilities and biotechnology and pharmaceuticals companies such as BASF, Novo Nordisk, Merck and GlaxoSmithKline.",['biotech']
Institute for Biotechnology | St. John's University,"Pharmaceutical biotechnology draws upon such disciplines as microbiology, biochemistry and molecular and cellular biology. The biopharmaceutical industry¬†...",['biotech']
DMACC Biotechnology Program,A Liberal Arts Associate in Science Degree and the Biotechnology Laboratory Methods Certificate will prepare you for work in a laboratory position in a variety¬†...,['biotech']
Biotechnology | Products | Springer Nature,"The top 100 FTSE biotech companies rely on the latest research to develop life-saving therapies, improve existing medicine and find treatments against¬†...",['biotech']
Project Biotech | Shoreline Community College,Shoreline Community College's Biotechnology Lab opens its doors to high school students for week-long explorations of biotechnology and DNA sequencing! At¬†...,['biotech']
Biotech Careers | The best source of information about biotech ...,"An educational resource about working and finding work in the biotechnology industry. Career information, job and internship postings, a large biotech¬†...",['biotech']
"Santa Cruz Biotechnology: Antibodies, Gene Editors ...","SCBT is a leading producer of monoclonal antibodies, RNAi, CRISPR KO/Activation products and chemicals for research. Cited in over 360693 publications.",['biotech']
BIOTECH,Classroom visits conducting Biotechnology and Molecular Biology activities in middle school and high school classrooms ¬∑ Equipment and material support for¬†...,['biotech']
Anaxomics Biotech SL - Systems Biology Solutions,Anaxomics is a bioinformatics company molecularly modelling human physiology through Systems Biology and Artificial Intelligence. Our mathematical models of¬†...,['biotech']
Biotechnology - Citrus College,"Biotechnology utilizes living cells to produce medicine, food, and alternative fuels, as well as remove environmental toxins. The biotechnology program at¬†...",['biotech']
Biotech - Governor's Office of Business and Economic ...,More bioscience and biotechnology patents are issued to California companies ... These investments keep California at the forefront of biotech innovation.,['biotech']
Biotechnology - Collin College,Biotechnology. Learn how to apply the biological sciences toward a career in biological or industrial research with the Biotechnology program at Collin¬†...,['biotech']
BioTech Agronomics | Your Premiere Biosolids Management ...,"Aug 13, 2021 ‚Äî A Full-Service Residuals and Biosolids Management Firm. Biotech Agronomics, owned by Kevin Bonney, is your premiere biosolids solution.",['biotech']
Biotech Partners,"Biotech Academy Students Have a 100% Graduation Rate. Biotech Partners Facilitates Access to Scientific Careers Through a Biotech-focused Curriculum,¬†...",['biotech']
Nebraska Center for Biotechnology - University of Nebraska ...,"The Nebraska Center for Biotechnology provides state of the art technologies for research through core facilities, provides training to faculty,¬†...",['biotech']
Calypso biotech | Antibody therapies for severe autoimmune ...,Learn more. Therapeutic antibodies against immune checkpoints to treat emerging severe pathologies. Learn more. ¬© Calypso Biotech 2018 ‚Äì Legal disclaimer.,['biotech']
"Biotech Atelier 2022 | 28-30 Sep 2022, Save the date","Sep 24, 2021 ‚Äî The European annual business conference, uniting Biotech, Life Sciences, IT, Health Care, and Pharma. Futurists. Business leaders.",['biotech']
Biotechnology | Delaware Technical Community College,Biotechnology. Associate Degree Program. Biotechnology provides a career path for students with an interest in science and how things work.,['biotech']
Biotech - Biologics Contract Manufacturing - Wacker Chemie AG,"Wacker Biotech is the microbial CDMO ‚Äì your all-in-one partner of choice for contract manufacturing of therapeutic proteins, vaccines and live microbial¬†...",['biotech']
Texas Biotech - Bigger and Better,"Nearly 99000 Texans work in biological sciences and biotechnology, and their efforts directly and indirectly support an estimated 306000 more Texas jobs.",['biotech']
BIOTECH,Classroom visits conducting Biotechnology and Molecular Biology activities in middle school and high school classrooms ¬∑ Equipment and material support for¬†...,['biotech']
"Biotech Atelier 2022 | 28-30 Sep 2022, Save the date","Sep 24, 2021 ‚Äî The European annual business conference, uniting Biotech, Life Sciences, IT, Health Care, and Pharma. Futurists. Business leaders.",['biotech']
Powering the Age of Immune Medicine - Adaptive Biotech,Adaptive Biotechnologies is harnessing the immune system to unleash its power as a natural diagnostic and therapeutic tool to propel a paradigm shift in¬†...,['biotech']
Biotechgate: Your source for life science information,"Costing less than a single business trip, a subscription to Biotechgate gives you real-time information at your fingertips on the Biotech, Pharma, Medtech,¬†...",['biotech']
Longevity Biotech,Hybridtides¬Æ are a new class of drug candidates that deliver unique product profiles. Preclinical Development. Longevity Biotech has multiple preclinical¬†...,['biotech']
Sirion Biotech: Viral Vector Manufacturing & Services,Any Gene to Any Cell. SIRION Biotech designs and manufactures viral vectors for cell and gene therapy research and preclinical development. We have active R&D¬†...,['biotech']
Biotechnology | HVCC,"The Biotechnology degree program offers you the educational background needed ... As a biotechnology student at Hudson Valley, you'll be offered a strong,¬†...",['biotech']
Bio-Tech Pharmacal | Best Vitamin D & All-Natural Supplements,"Bio-Tech's all-natural vitamins & supplements help support the daily needs customers care about most: joint support, bone health, cardiovascular health,¬†...",['biotech']
Clara Biotech: Exosome Isolation,Clara Biotech is changing the way exosomes are isolated & purified. Viable isolation results every single time with our ExoRelease system.,['biotech']
Biotechnology | Austin Community College District,"Austin Community College's Biotechnology Program is a key partner in developing a biotech education center and is home to the Bioscience Incubator,¬†...",['biotech']
Downstate Biotechnology Incubator,Downstate Biotechnology Incubator. Offering state of the art wet laboratory and office space for start-ups and early-stage biotech companies.,['biotech']
Biotechnology - Cooley,"2019 Firm of the Year for Biotechnology Law by The Best Lawyers in America ... Team includes former biotech researchers, pharmaceutical marketing¬†...",['biotech']
Bachelor's Degree in Biotechnology - University of Nevada ...,"What will I learn in a biotechnology degree program? ¬∑ Coursework and lab work that offer a solid foundation in biochemistry, molecular biology, immunology and¬†...",['biotech']
We Connect the Bioscience Community | Virginia Bioscience,Beer and Biotech: The Future of Biotech in the Region. 03/16/2022. 4:30 am ‚Äì 6:30 pm EST ¬∑ Acceleration & Incubation: Two Paths to Bring Your Science to¬†...,['biotech']
Geneva Biotech: Home,"Geneva Biotech is a privately held biotechnology company, based in Geneva, Switzerland. Founded in 2012 ¬∑ Menu ¬∑ Large DNA cargo gene delivery and genome¬†...",['biotech']
Biotechnology ETF List,"SymbolETF NameAsset ClassSectorTotal Assets ($MM)YTDIBBiShares Biotechnology ETFEquityHealthcare$7,718.98‚Äë21.16%XBISPDR S&P Biotech ETFEquityHealthcare$6,263.00‚Äë24.69%ARKGARK Genomic Revolution ETFEquityHealthcare$3,311.38‚Äë30.49%View 17 more rows",['biotech']
MS in Biotechnology | Duquesne University,"The Master of Science in Biotechnology is designed to provide advanced graduate training in the natural sciences, while enabling students to consider other¬†...",['biotech']
Wake Forest Biotech Place,Wake Forest Biotech Place and the Richard H. Dean Biomedical Research Building support many of our basic scientists and preclinical researchers.,['biotech']
"Washington Biotechnology, Inc.","Washington Biotechnology, Inc. (WBI) is a leading In Vivo Services Contract Research Organization (CRO) for drug development.",['biotech']
Center for Biotechnology ‚Äì Stony Brook University,"LONG ISLAND BIOSCIENCE HUB ... Fostering the development of therapeutics, preventatives, diagnostics, devices and research tools emerging from LIBH partner¬†...",['biotech']
Tiba Biotech: Home,Next Gen RNA Vaccines and TherapeuticsTiba Biotech is advancing the RNA medicine field with an improved approach to nucleic acid delivery.,['biotech']
Solvo Biotechnology: Drug Drug Interaction Studies ...,SOLVO Biotechnology is a Charles River company. You can find more information here. charles river logo. Our vision is to be globally renowned as a¬†...,['biotech']
Anima Biotech - mRNA Lightning Platform,Anima Biotech - mRNA Lightning | A novel platform for the discovery of selective small molecule mRNA drugs and their mechanisms of action.,['biotech']
Center of Excellence in Industrial Biotechnology - Huck ...,"Center of Excellence in Industrial Biotechnology ... Penn State will welcome a new biotech company, BioMagnetic Solutions, to Innovation Park.",['biotech']
Biotech Basics - HudsonAlpha Institute for Biotechnology,Do you want to help your students grasp foundational biotechnology concepts? Check out these Alabama Course of Study aligned articles written in student and¬†...,['biotech']
ISAAA.org: International Service for the Acquisition of Agri ...,The International Service for the Acquisition of Agri-biotech Applications (ISAAA) is a not-for-profit international organization that shares the benefits¬†...,['biotech']
Current Opinion in Biotechnology | Journal | ScienceDirect.com,"Read the latest articles of Current Opinion in Biotechnology at ScienceDirect.com, Elsevier's leading platform of peer-reviewed scholarly literature.",['biotech']
Tiba Biotech: Home,Next Gen RNA Vaccines and TherapeuticsTiba Biotech is advancing the RNA medicine field with an improved approach to nucleic acid delivery.,['biotech']
BioTech Pharma Summit ‚Ä¢ Tomorrow's healthcare congress,The BioTech Pharma Summit brings together the movers and shakers in Pharma & Biotech industry from several areas. Uniting niche and top buyers and sellers.,['biotech']
Solvo Biotechnology: Drug Drug Interaction Studies ...,SOLVO Biotechnology is a Charles River company. You can find more information here. charles river logo. Our vision is to be globally renowned as a¬†...,['biotech']
Anima Biotech - mRNA Lightning Platform,Anima Biotech - mRNA Lightning | A novel platform for the discovery of selective small molecule mRNA drugs and their mechanisms of action.,['biotech']
Center of Excellence in Industrial Biotechnology - Huck ...,"Center of Excellence in Industrial Biotechnology ... Penn State will welcome a new biotech company, BioMagnetic Solutions, to Innovation Park.",['biotech']
Biotech Basics - HudsonAlpha Institute for Biotechnology,Do you want to help your students grasp foundational biotechnology concepts? Check out these Alabama Course of Study aligned articles written in student and¬†...,['biotech']
ISAAA.org: International Service for the Acquisition of Agri ...,The International Service for the Acquisition of Agri-biotech Applications (ISAAA) is a not-for-profit international organization that shares the benefits¬†...,['biotech']
Current Opinion in Biotechnology | Journal | ScienceDirect.com,"Read the latest articles of Current Opinion in Biotechnology at ScienceDirect.com, Elsevier's leading platform of peer-reviewed scholarly literature.",['biotech']
Master of Biotechnology ‚Äì A Joint Program of the School of ...,"Penn's world-class biomedical research centers, renowned science departments and position at the hub of the largest pharmaceutical/biotechnology corridor in the¬†...",['biotech']
Biotech Team | Biopharmaceutical Manufacturing Specialists ...,"Led by top minds across science and industry, our experience spans biopharmaceutical manufacturing, drug research and development, and more.",['biotech']
NYU Langone opens NYC's largest biotech incubator with ...,NYU Langone Health opened a 50000-square-foot biotech incubator space in Manhattan that has attracted backing from big-name corporate sponsors including¬†...,['biotech']
Biotechnology | CNM,The Biotechnology program prepares you for transfer to a four-year program in Biology. Earn an Associate of Science or certificate and pursue work as a¬†...,['biotech']
Business of Biotech - Moffitt Cancer Center,"Today the conference attracts over 400 biotech executives, entrepreneurs, venture capitalists, angel investors and researchers from across the U.S. and is a¬†...",['biotech']
Biotechnology Science (AS) - BMCC,"Biotechnology is considered an emerging science with a broad range of career ... bachelor degree programs in Biotechnology, or in the Biological Sciences.",['biotech']
Promega Corporation,"Promega Corporation is a worldwide leader in applying biochemistry and molecular biology to the development of innovative, high-value products for the life¬†...",['biotech']
Biotechnology - European Commission,"The main applications of biotechnology in the EU economy can be classified into three broad groups: In healthcare and pharmaceutical applications, biotechnology¬†...",['biotech']
Cathie Wood Watch: Ark Buys Biotech Stocks - TheStreet,"1 day ago ‚Äî Investment star Cathie Wood, chief executive of Ark Investment Management, on Tuesday had focused some of her buying on biotechnology stocks¬†...",['biotech']
ZZ Biotech,"ZZ Biotech, LLC - Developing Innovative Biologic Treatments. ZZ Biotech is a clinical stage biopharmaceutical company advancing new treatments for some of the¬†...",['biotech']
Biotechnology News - ScienceDaily,"Biotechnology News. Read the latest research from around the world on genetic engineering, drug development and more.",['biotech']
"Connecticut Biotech: CTBioTech - N95 Masks, Surgical Masks ...","CTBioTech is the one-stop shop for all your PPE needs. NIOSH Approved N95 Masks, FDA EUA Authorized N95 Masks, Surgical Masks, Nitrile Gloves,¬†...",['biotech']
Biotechnology News - ScienceDaily,"Biotechnology News. Read the latest research from around the world on genetic engineering, drug development and more.",['biotech']
Business of Biotech - Moffitt Cancer Center,"Today the conference attracts over 400 biotech executives, entrepreneurs, venture capitalists, angel investors and researchers from across the U.S. and is a¬†...",['biotech']
Pharma and Biotech | Covington & Burling LLP,Covington is the recognized leader in representing clients on FDA and related regulatory matters involving human pharmaceuticals and biotechnology products¬†...,['biotech']
Southern Biotech,"SouthernBiotech provides reliable antibodies for research use in diagnostics, drug development, and discovery studies. Learn more about our products here.",['biotech']
Cathie Wood Watch: Ark Buys Biotech Stocks - TheStreet,"1 day ago ‚Äî Investment star Cathie Wood, chief executive of Ark Investment Management, on Tuesday had focused some of her buying on biotechnology stocks¬†...",['biotech']
"Connecticut Biotech: CTBioTech - N95 Masks, Surgical Masks ...","CTBioTech is the one-stop shop for all your PPE needs. NIOSH Approved N95 Masks, FDA EUA Authorized N95 Masks, Surgical Masks, Nitrile Gloves,¬†...",['biotech']
RayBiotech: Empowering Your Proteomics,"RayBiotech, a leading life sciences company providing proteomic discovery tools. Your comprehensive source for protein research kits, reagents,¬†...",['biotech']
