titles,summaries,terms
GARMIN,"Garmin deals with consumer electronics like GPS-equipment for automotive industry, marine, and other products for outdoor markets.",['sport tech']
GYMLIB,Gymlib is a French startup that offers fitness spaces.,['sport tech']
BURNALONG,BurnAlong is a personalized wellbeing class and social motivation to help people get the health and wellness they need.,['sport tech']
Omsignal,"OMsignal is “apparel that continuously tracks your biometrics to help you connect to a fitter, healthier, happier you.”",['sport tech']
Playsight,"PlaySight is a pioneer in the emerging market of affordable, consumer sports analytics systems and co-founder Chen Shachar and team created their new tennis arm SmartCourt now its raised around $5million in funding rounds.",['sport tech']
"Zepp Labs, Inc.",This startup uses 3-D motion technology to produce data and communicate it real-time in a meaningful way with Bluetooth activation and also raised $15 million in new VC funding to get up and running.,['sport tech']
 Strava,"Strava targets intense exercisers—those who work out several times a week—and is mainly focused on cyclists and extreme athletes, which makes sense as the inspiration behind Strava was an online cycling club.",['sport tech']
ESTAFETA,"Estafeta is an online sports store that offers sportswear, shoes, electronics and range of accessories for outdoor activities and sport.",['sport tech']
MOTIFY,"Workout with personal trainers anywhere, anytime with our wellness app.",['sport tech']
FITSSEY,"Fitssey is an online booking system and studio management app for yoga, fitness clubs, pilates and pole dance classes.",['sport tech']
PRODUCTFITTER,"ProductFitter make awesome solutions using modern technologies for Design & Development of Web Apps, Mobile Apps & Websites.",['sport tech']
RunKeeper ,RunKeeper is a fitness technology company that packs the benefits of a personal trainer into the convenience of a smartphone,['sport tech']
Regeneron Pharmaceuticals Inc.,"Biopharmaceutical company Regeneron develops and markets drug treatments for patients with eye disease, cancer, cardiovascular diseases, allergic and inflammatory issues, and infectious diseases. Through its Regeneron Genetics Center, the company aims to conduct one of the largest gene sequencing operations worldwide.",['biotech']
Alexion Pharmaceuticals Inc.,"Alexion is a biopharmaceutical company that develops and markets immunoregulatory drugs for the treatment of cardiovascular and autoimmune diseases. Through its drug therapies, Alexion aims to provide patients with compounds that selectively target portions of the immune system which may allow diseases to proliferate.",['biotech']
Vertex Pharmaceuticals Inc.,"Biopharmaceutical company Vertex focuses on creating and marketing drug treatments for patients suffering from cancer, cystic fibrosis, autoimmune diseases, and neurological disorders, among others.",['biotech']
Jazz Pharmaceuticals PLC (JAZZ),"Irish biopharmaceutical company Jazz Pharmaceuticals creates and commercializes drug products designed to address issues related to narcolepsy, psychiatry, pain management, and oncology. On March 25, the company announced FDA approval of its drug JZP-258 for the treatment of cataplexy or excessive daytime sleepiness.",['biotech']
Incyte Corp.,"Focusing on small molecule drugs for use in oncology primarily, Incyte is a biopharmaceutical company responsible for discovering, developing, and marketing drug therapies. The company is best known for its drug Jakafi, a treatment for myelofibrosis.",['biotech']
Biomarin Pharmaceutical Inc.,"A maker of therapeutic enzyme products, Biomarin Pharmaceutical develops drug treatments for lysosomal storage diseases as well as serious burns. The company also provides diagnostic and analytic services for carbohydrate biology applications.",['biotech']
United Therapeutics Corp.,"United Therapeutics primarily develops drug treatments for pulmonary hypertension, peripheral vascular disease, and other vascular conditions. Among the company's most popular medicines are Remodulin, Orenitram, Unituxin, and Tyvaso.",['biotech']
Alkermes PLC,"Alkermes is an Irish biopharmaceutical company. This firm creates treatments for central nervous system disorders including depression, schizophrenia, and addiction. It also focuses on treatments for diabetes.",['biotech']
Ionis Pharmaceuticals Inc.,"Biotechnology company Ionis discovers and develops RNA-based therapeutic products. Its three primary, commercially-available medicines include WAYLIVRA, Spinraza, and Tegsedi. It also has drug treatments in various stages of development to treat Huntington's disease, ALS, and cardiovascular disease.",['biotech']
Freedom Financial Network,"Debt hampers countless consumers, so Freedom Financial Network is giving people a second chance to build a path to financial security. Through free consultations, debt and loan consultants can assess each customer’s financial situation and develop a personalized plan to pay off debt. Customers can track their progress through an intuitive online dashboard while receiving extra guidance from videos and blogs on Freedom Financial's website. ",['fintech']
Wintrust Financial Corporation,"Big names have dominated the banking industry, but Wintrust Financial Corporation offers a more personalized approach. Customers can support their life goals with checking accounts, savings accounts, mortgages, credit cards, and other financial tools. In addition, customers can look forward to a more connected banking experience with online and mobile banking options.",['fintech']
Northern Trust,"Boasting over a century of experience, Northern Trust has grown into a financial leader trusted by customers around the globe. From investing to wealth management, families, corporations, and other entities can access a variety of financial services through Northern Trust. The institution blends extensive market data with cutting-edge technology, ensuring clients make decisions that place them on solid financial ground for years to come.   ",['fintech']
Earnest,"Student debt often hinders those looking to enter the next chapter of their lives, so Earnest is easing the burden of paying for higher education. The company helps students find the lowest possible interest rates to chip away at years of potential debt. Customers can also set their loan terms, remove cosigners, and consolidate loans. By prioritizing affordability and flexibility, Earnest is redefining the relationship between students and student loans. ",['fintech']
Western Union,"Western Union helps customers move currencies all over the world with a suite of financial tools. Leveraging the Western Union platform, users can initiate transactions online, through an app, or over the phone. The institution has a strong presence in dozens of countries, allowing customers to transport money faster than ever. As a result, Western Union makes managing money across long distances more efficient and secure.",['fintech']
Unanet,"Organizing a project is no easy feat, but Unanet is simplifying the process with its project management platform. The platform enables professionals to track finances, automate repetitive tasks, analyze data, and make informed business decisions. The company provides government contractors, architects, engineers, and construction workers with numerous ways to streamline their workflows and allocate resources where they’re needed most. ",['fintech']
Array,"People make purchases on a daily basis, but seldom do they understand how each transaction affects their financial health. Array is developing a more transparent and secure way to shop with its digital platform. Companies can now provide shoppers with credit score visibility, identity protection, and more personalized offers through the thoughtful tools of Array.",['fintech']
Great Minds,"As a knowledge company, Great Minds seeks to teach a deep understanding of the world through content-rich courses. From math to English, each Great Minds course integrates real-world contexts and core skill development. Teachers and students can build stronger connections to materials that go beyond memorizing facts, thanks to the thorough approach of Great Minds.",['edtech']
BrainPOP,"To help kids better connect to the subjects they're learning, BrainPOP is bringing a more playful approach to the classroom. Students can engage with topics through interactive games, videos, and activities. From math to music, kids can explore different pathways while growing their social skills. As a result, learning becomes much more compelling and comprehensive with the tools of BrainPOP. ",['edtech']
Outschool,"To instill a love for learning at an early age, Outschool is connecting kids to a convenient online platform. The company hosts a diverse range of classes, so students ages 3-18 can choose courses that match their interests. Students can also access small group and one-on-one sessions, ensuring they get the time and attention they need to master the materials. ",['edtech']
TutorMe,"TutorMe provides online access to a network of educators for students who need help outside of the classroom. From computer science and engineering to English and ethnic studies, TutorMe offers support in a variety of subjects. To make their 24/7 services even more convenient, TutorMe partners with public schools and libraries for an ideal learning experience.",['edtech']
Udacity,"Udacity is an online platform that provides a pathway for job-seekers to learn job-ready skills that will prepare them for the career of their future. The platform offers a variety of programs and courses on subjects like artificial intelligence, cloud computing, product management, data science, cybersecurity and more, providing people with vital, in-demand skills to advance their careers.",['edtech']
MasterClass,"MasterClass is an online platform that allows users to take online classes and learn from world-leading experts in their craft. Instructors in categories ranging from cooking through writing, music, sports, filmmaking and much more, including Stephen Curry, Gordon Ramsey and Annie Leibovitz, are available through Masterclass to provide unique insights that can only be learned from accomplishing life’s greatest achievements.","['edtech,'sport tech']"
A Cloud Guru,"A Cloud Guru is an edtech company that offers online cloud computing courses to engineers and engineers-in-training. Courses ranging from the basics on Cloud-focused coding for the Cloud to AWS certifications are available on A Cloud Guru’s platform, which allows students to learn in a more engaging environment than traditional online education methods.",['edtech']
New Examples of Sports Technology That's Changing The ...,"Oct 22, 2019 ‚Äî New Examples of Sports Technology That's Changing The Game ¬∑ Sensors ¬∑ Wearable Tech ¬∑ VAR ¬∑ Reflexion ¬∑ Protective Equipment ¬∑ Timing Systems ¬∑ ABS.",['sport tech']
SportTechie | Sports Technology News,"At SportTechie, we make sports smarter. Through immersive storytelling and industry-leading events, we connect you to the innovators and power brokers who¬†...",['sport tech']
The future of sports tech: Here's where investors are placing ...,"Oct 1, 2019 ‚Äî Technology has been quietly transforming the world of sports for years, with investment in areas like esports continuing to rise, surpassing a¬†...",['sport tech']
The Evolution of Technology in Sport - Hire Intelligence,"Learn about the evolution of technology in sport with Hire Intelligence, including how technology in athletics, football and tennis has changed.",['sport tech']
Technology in Sports,"Sport Specific ¬∑ Tennis - it is now standard at the major tennis tournaments for a line review system to be in place, with players given power to review¬†...",['sport tech']
How Technology is Revolutionizing Sports Training - Ohio ...,Perhaps the most important byproduct of technology in sports training is that injuries have been severely reduced and now can be identified much earlier.,['sport tech']
20 Ways Technology Makes Sports Better | Bleacher Report,"Technology helps athletes, both amateur and professional, find out what is wrong with a particular part of their game, and helps them fix it. It is a¬†...",['sport tech']
Top 5 Sports Tech News ‚Äì Feb 2021,"Mar 10, 2021 ‚Äî Welcome to the top5 sports tech news of Feb 2021. In this edition, we cover a game-changing use of technology that is super impactful for¬†...",['sport tech']
"Sports Technology: The Good, the Bad, and the Ugly","Speed timing gates, motion capture systems, force plates, velocity-based training tools, athlete management systems, online programming platforms, and injury¬†...",['sport tech']
Sports Technology - CES 2022,"Discover how technology is changing the business of sports through enhancing athletic performance, smart arenas, esports and next-generation sponsorships.",['sport tech']
How Technology in Sport is Changing the Game | Technogym,"The use of technology in sports is growing rapidly. In football, for instance, new devices are used for different reasons such as to help referees in¬†...",['sport tech']
Sport Technology - Google Books Result,"Stewart Ross ¬∑ 2010 ¬∑ ‚ÄéJuvenile NonfictionSee it again The video replay is a key element of the modern sporting scene. ... technology has introduced another, more controversial element to sport¬†...",['sport tech']
Sport Technology Systems -,"TO TRAIN AND PLAY. Christian Sist, CEo. CONTENT. We create unique content, based on science, pushing your limits¬†...",['sport tech']
Synergy Sports: Home,Our vision is for global sports at every level to have the content and technologies to raise their game and create a more immersive experience.,['sport tech']
Sport Technology Jobs - 2022 | Indeed.com,"Apply to Sport Technology jobs now hiring on Indeed.com, the worlds largest job site.",['sport tech']
Sport Technology - Domains of innovation ‚Äê EPFL,"Sport Technology. Performance, Health and Entertainment. Sports innovations don't just boost athletes' performance, they can improve everyone's life.",['sport tech']
Sport technology: A commentary | Request PDF - ResearchGate,"The sports industry in all its fields is increasingly in need of technology to facilitate its proper performance (2) . Today, technological innovations seem to¬†...",['sport tech']
Sports Technology Ltd | LinkedIn,Sports Technology Ltd | 600 followers on LinkedIn. The team behind Sport Technology have unprecedented experience designing AV solutions for major¬†...,['sport tech']
"Study Sports Technology, Subjects, University of Otago, New ...","How does technology enhance sporting performance? With advanced analysis tools, hi-tech sportswear, innovative design in training equipment and programmes, and¬†...",['sport tech']
Fusion Sport | Human Performance Technology,Fusion Sport is the developer of the Smartabase Human Performance Platform and Athlete Management System and Smartspeed Timing Gate Systems.,['sport tech']
Technology and Innovation | Australian Institute of Sport,The Australian Sports Commission recognises the outstanding contribution that Aboriginal and Torres Strait Islander people make to society and to sport in¬†...,['sport tech']
Technology in Sport: Three Ideal-Typical Views and Their ...,"by S Loland ¬∑ 2003 ¬∑ Cited by 108 ‚Äî Technology that requires athletic efforts and skills, to which there is equal access, and that. Sigmund Loland | Technology in Sport | www.idrottsforum.org |¬†...11 pages",['sport tech']
Sport technology: A commentary - NCBI,by V Ratten ¬∑ 2020 ¬∑ Cited by 21 ‚Äî The sport industry is increasingly being influenced by technology innovation for its global competitiveness. Technology is evident in sport¬†...,['sport tech']
20 sports tech ideas to invest in now - Class of 2020 - SportsPro,"Jan 31, 2020 ‚Äî The global sports tech ecosystem is awash with early-stage companies and ... sports, gaming, content production and in-venue technology has¬†...",['sport tech']
Merge Sport | How technology will revolutionise sport for fans,Merge Sport | How technology will revolutionise sport for fans. Launch of first ever Fuse publication looks to the future of the sports experience for fans¬†...,['sport tech']
Sports Technology Institute | Loughborough University,"Engineering Sport. We have a vision that technology can enhance the experience, performance and safety of anyone involved in sport.",['sport tech']
Ascend Sport Technology - Crunchbase Company Profile ...,"Ascend creates sports technology companies by leveraging cutting-edge technologies such as AI, digital targeted advertising, and big data.",['sport tech']
The Use of Applied Technology in Team Sport - Routledge,"The use of technology within sport is well established, most professional sport teams engage in the use of electronic performance and tracking systems.",['sport tech']
Global Sport Technology,"Welcome to the site of the Global Sport Technology, Inc. (GST) ... and training equipment as well as training software to reach quality in live and sport.",['sport tech']
sport-technology.si,WE GUARANTEE THE OPTIMAL CONDITIONS FOR THE TRAINING IN ALL SPORT BRANCHES. We are a specialised company in the area of sport infrastructure.,['sport tech']
Women in Sports Tech,Women in Sports Tech is the non-profit driving transformative growth opportunities for women at all stages of their careers throughout the sports tech and¬†...,['sport tech']
The Evolution of Technology & Sports,"Nov 13, 2018 ‚Äî Throughout the past 200 years, technology and technological advancements in the sporting world has been prevalent. Within sports, technology¬†...",['sport tech']
Sport Industry: The impact of technology on sport - Online ...,Technology in Sport ¬∑ Analysis of sport performance and enabling coaches to greatly improve the quality of feedback to players/athletes ¬∑ Increase accuracy in¬†...,['sport tech']
Sport and technology ‚Äì An actor-network theory perspective,"by R Kerr ¬∑ 2016 ¬∑ Cited by 37 ‚Äî We now utilise a range of interconnected technologies at work, at home and at leisure. The realm of sport is no exception, where new ... Show More.",['sport tech']
"Sport technology ‚Äì News, Research and Analysis - The ...","Articles on Sport technology ¬∑ Nike Vaporfly ban: why World Athletics had to act against the high-tech shoes ¬∑ Wafer-thin bicycles, speedy shorts, go-faster¬†...",['sport tech']
Sport and technology ‚Äì An actor-network theory perspective,"by R Kerr ¬∑ 2016 ¬∑ Cited by 37 ‚Äî We now utilise a range of interconnected technologies at work, at home and at leisure. The realm of sport is no exception, where new ... Show More.",['sport tech']
"Sport technology ‚Äì News, Research and Analysis - The ...","Articles on Sport technology ¬∑ Nike Vaporfly ban: why World Athletics had to act against the high-tech shoes ¬∑ Wafer-thin bicycles, speedy shorts, go-faster¬†...",['sport tech']
LYCRA¬Æ SPORT technology | Certified performance,"Why choose LYCRA¬Æ SPORT technology? The challenge: Consumers are increasingly demanding activewear that optimizes performance, but comfort is often neglected.",['sport tech']
20 sports tech ideas to invest in now - Class of 2020 - SportsPro,"Jan 31, 2020 ‚Äî The global sports tech ecosystem is awash with early-stage companies and ... sports, gaming, content production and in-venue technology has¬†...",['sport tech']
Sport and technology: An actor-network theory perspective,by R Kerr ¬∑ 2016 ¬∑ Cited by 1 ‚Äî How do new technologies come to be used in sport? This book moves beyond the idea of functionality to explore the many other important factors that athletes¬†...,['sport tech']
Master in Sport Technologies and Digital Transformation Madrid,"This pioneering and unique program answers the sport industry's need for qualified profesionals in new technologies and digital transformation.Mon, Oct 24Master in Sport Technologies ...",['sport tech']
Should Technology in Sports Be Limited? - The Cal Connection,"Mar 23, 2021 ‚Äî With the technological world constantly advancing, the questions of whether technology should be evolving in the industry of sports is a¬†...",['sport tech']
Digital Transformation and Future Changes in the Sports ...,"Why technological changes are important in sports. Digital technology is unlocking unprecedented opportunities for growth in the sports industry, offering the¬†...",['sport tech']
Six Technological Advancements That Have Changed Sports,"Jul 18, 2016 ‚Äî Six Technological Advancements That Have Changed Sports ¬∑ Hawk-Eye Technology ¬∑ HANS device ¬∑ Video Technology ¬∑ Wearable Computers ¬∑ Prosthetic¬†...",['sport tech']
The Impact of Technology on Sport II 1st Edition - Amazon.com,"The Impact of Technology on Sport II [Fuss, Franz Konstantin, Subic, Aleksandar, Ujihashi, Sadayuki] on Amazon.com. *FREE* shipping on qualifying offers.",['sport tech']
The Impact of Technology on Sport II 1st Edition - Amazon.com,"The Impact of Technology on Sport II [Fuss, Franz Konstantin, Subic, Aleksandar, Ujihashi, Sadayuki] on Amazon.com. *FREE* shipping on qualifying offers.",['sport tech']
Advantages and disadvantages of technology - BBC,Learn about and revise technology in sport with this BBC Bitesize GCSE PE (WJEC) study guide.,['sport tech']
Smart Sports - Carnegie Mellon University | CMU,"A New Course in Sports Technology. Sports Technology. As you run, your playlist matches the next song with your tempo; your tennis racket offers tips on how to¬†...",['sport tech']
Masters Degrees in Sport technology - FindAMasters,"Results 1 - 15 of 92 ‚Äî Are you looking for a Masters degree in Sport Technology? Compare postgraduate programmes and find out about course content,¬†...",['sport tech']
SMT (SportsMEDIA Technology),"SMT's broadcast and on-site solutions play an integral role in the world's most prestigious sporting and entertainment events, providing producers with¬†...",['sport tech']
How is technology affecting sport? - Oxford University Press,"Technology plays a major role in sport: it has changed the way athletes perform, the way professional sports are officiated, and the way fans watch the game¬†...",['sport tech']
Sport Technology - Stewart Ross - Google Books,"Sports Technology looks at developments in the world of sport, and explores the way in which technology has enhanced both the players and the supporters¬†...",['sport tech']
20 sports tech ideas to invest in now - Class of 2020 - SportsPro,"Jan 31, 2020 ‚Äî The global sports tech ecosystem is awash with early-stage companies and ... sports, gaming, content production and in-venue technology has¬†...",['sport tech']
rogue sport advanced technology - Nissan USA,"Explore the technology of the 2022 Nissan Rogue Sport. The Rogue Sport features smartphone connectivity with Apple Carplay and Android Auto,¬†...",['sport tech']
Sports Tech World Series: STWS Home,The Sport Tech Annual is an industry publication with expert industry insights and a comprehensive directory of key companies in sports tech. Read Now.,['sport tech']
"International Workshop on Sport, Technology and Research","The 2022 IEEE International Workshop on Sport, Technology and Research will be held in Cavalese (Italy) from 13 to 15 July 2022.",['sport tech']
How can technology protect and improve the future of sport?,"Feb 17, 2021 ‚Äî And while this trend was always likely to increase, the pandemic may lead to sports teams utilising wearable tech as a method of ensuring health¬†...",['sport tech']
The Psychology of Endurance-Sport Technology,"Oct 26, 2021 ‚Äî Endurance-sport technology has a major psychological impact. A good smart training watch produces data that can change the way we think,¬†...",['sport tech']
MSc Sports Technology | KTH | Sweden,"Technically, Sports Technology focuses on the measurement, simulation, and motion and performance analysis. The programme consists of traditional engineering¬†...",['sport tech']
The sports tech that actually makes you faster by Precision ...,Dr Bryce Dyer explores some of the current technological innovations in sport to see if they really can give you a performance gain...,['sport tech']
9 Game-Changing Ways Technology Benefits Sports,"Mar 28, 2021 ‚Äî Technology has changed sport in so many ways, from instant replay technology to gaming. How many benefits have you noticed?",['sport tech']
Sport Management | WVU Tech Admissions | West Virginia ...,"Intern with a team, athletic department, sporting goods company or outdoor recreation organization. There's more to sport than the game on the court or field¬†...",['sport tech']
15 innovations pushing human performance to the limit,"Jul 19, 2016 ‚Äî Sport science and technology are helping athletes ‚Äì professional and amateur ‚Äì to optimise their physical output. WIRED explains how.",['sport tech']
Why technology has a powerful impact on sport today,"Dec 5, 2019 ‚Äî With that being said, how exactly did technology change the sports industry for the better? Improved athlete training. Athletes need more than¬†...",['sport tech']
STA Access Innovation - Sports Tech Group,Technology is the single greatest force changing every aspect of sport. ... coaching on the most relevant and important technologies impacting sports¬†...,['sport tech']
